,answers,options,questions,article,id
1,D,"['The eastern Philippines.', 'The southern tip of Vietnam.', 'The South China Sea.', 'The central Philippines.']",Which of the following places suffered most when Typhoon Haiyan rolled in?,"At least 3 people are dead in the Philippines now that Typhoon Hagupit has landed.
The typhoon, which hit the eastern Philippines over the weekend, has blown down trees and sent more than 650thousand people into shelters before weakening.
""There were very strong winds last night. The roof was beginning to move, and rain was getting inside the rooms,"" said a villager.
The storm hit with gusts   of over 100 miles per hour. And while the storm has slowed considerably from the super typhoon level it had last week, Hagupit still remains strong enough to create more damage.
Christopher Perez is a local weather forecaster. He says, ""We are continuing to expect bad weather and rough ocean waves. Threats of possible flash floods and landslides   as well as possible storm waves are occurring in coastal areas.""
Hagupit is expected to roll into the South China Sea tomorrow.
It's currently going westward toward the southern tip of Vietnam, meaning it's unlikely to affect China.
Hagupit's strength in the Philippines is much less severe than Typhoon Haiyan, which rolled through the country in 2013.
Haiyan's tsunamilike storm waves and killer winds left thousands of people dead and _ .
The central Philippines is still trying to recover from last year's massive storm waves.",high13828.txt
