,answers,options,questions,article,id
0,C,"[""It doesn't provide food for visitors."", 'Visitors can take their pets to it.', 'Its name may come from its appearance.', ""Visitors can't make phone calls there.""]",What can you know about the Dog Bark Park Inn?,"It's always good to experience something new in life. Traveling gives plenty of such opportunities and when you choose a hotel to stay in next time, here, on this website, is a list of 4 most weird   hotels in the world.
Dog Bark Park Inn
If you keep a dog and love animals, then you will definitely become a fan of this hotel. The shape of the hotel reminds you of a dog. Here visitors will find a microwave oven to prepare a simple meal, games, puzzles and books to entertain themselves, an air conditioner and of course a bath. There is no TV set or a phone though.
Das Park Hotel
You will love the place because it is perfectly adjusted to basic human needs. However, there is one disadvantage to all these. The matter is that bathroom facilities are not included in the price. Each room here is quite small, but has a bed, electricity and air conditioning.
CasAnus
Read the name of the hotel attentively and you will easily guess what place exactly you are going to spend your vacation in! The hotel is situated in Kemzeke, Belgium and was designed by Joep van Lieshout. Do not say no to this hotel since it is quite comfortable and nice inside.
Hobbit Motel
Deep inside we stay kids forever. This is what the creators of the Hobbit Motel kept in mind when they were creating this motel. The Hobbit Motel is located in Woodlyn Park, New Zealand. You will recognize the inn by its blocks it is made of and the green roof covered with a thick layer of grass.",high19607.txt
