,answers,options,questions,article,id
0,B,"['to start a business', 'to employ English teachers', 'to provide the latest jobs', 'to help people find a suitable job']",The purpose of the advertisements is  _  .,"English Teacher Needed
We are one of the biggest English Teacher agency in China, we refer lots of foreign teacher/employee to university or company daily.We provide this service to teacher for free.
What you need to do is log on our website www.languageteaching.com.cn and register, we will put your resume  on Chinese website except contact details.There are thousand potential clients who will view your information daily, once they choose you we will contact with you.For any more details you also can send email to admin@languageteaching.com.cn
Part Time English Tutor wanted
We are looking for a part time English teacher, the teacher should come from U.S.A, Canada, UK, New Zealand or Australia.We would like to have 2 lessons a week, 2 hours each lesson.Please send me your Resume with photo if you are interested, email: admin@languageteaching.com.cn
Private English Tutor Wanted
Senior Chinese manager is looking for a one-on-one English tutor for several hours per week.He would like to learn British pronunciation, so UK nationals will be preferred.Tutors should be fairly flexible to suit his busy schedule and be of professional appearance.Pay is to be discussed directly and will be very high for the right candidate.Teaching experience is not a must.
If interested, please send an email with your background information, pay expectations and a recent picture to dhanyatk@hotmail.com.
 _ - Teacher/Librarian!
We are a small Kindergarten to Grade 6 international school in Beijing.We need a teacher/ librarian.The teacher we are looking for will: - Be a Chinese /English speaking librarian.
Qualifications
Be self-starters, active team players,
Have a positive attitude and love to work with kids
Provide an exciting and innovative library program to students.
If you meet the above qualifications, please send your CV and a current picture to principalinchina@yahoo.com .",high14630.txt
