,answers,options,questions,article,id
2,A,"['aims to change the world', 'tries to build more schools', 'has schools in nearly 200 countries', 'teaches people how to choose their courses']","According to the text, edX  _  ?","Do You Want To Change the Future of Education?
Our goal is to give a world-class education to everyone, everywhere, regardless of gender, income or social status.
Today, edx.org, a not-for-profit website, provides hundreds of thousands of people from around the globe with access to free education .We offer amazing quality classes by the best professors from the best schools. We enable our members to find out a new passion that will transform their lives and their communities.
Around the world from coast to coast, in over 192 countries, people are making the decision to take one or several of our courses. As we continue to grow our operations, we are looking for talented passionate people with great ideas to join the edX team. We aim to create an environment that is supportive ,diverse, and as fun as our brand.If you're hardworking and ready to contribute to an unparalleled member experience for our community, we really want you to apply.
As part of the edX team, you'll receive:
*Competitive compensation
*Generous benefits package
*Free lunch every day
*A great workplace where everyone cares and wants to change the world
While we appreciate every applicant's interest, only those under consideration will be contacted .We regret that phone calls will not be accepted. We promise that every applicant will be treated fairly.
All positions are located in our Cambridge offices.",high9309.txt
