,answers,options,questions,article,id
2,B,"['Les Pavillons', 'Beau Rivage', 'Diva', 'Legends']","According to the activity lists, children can learn some water sports in the Club of   _  .","Many of Nalade Resorts' hotels have Kids Club with special facilities for young children, making holidays more relaxing for parents and undoubtedly more pleasant and interesting for youngsters!
Kids Club in Beau Rivage (9 a.m. to 10 p.m.)
The club has a lovely atmosphere, with a large room for activities and a fenced, grass play-area outside. The qualified hostesses really know how to get on with children, as they look after and entertain youngsters from 3 to 12.
Activities are adapted according to children's ages and talents and include:
*Glass-bottom boat trips to see the brightly colored games
*Drawing and painting
*Making things and a whole host of indoor games
*Learning how to snorkel and water-ski
A baby sitting service is also available on request, for a fee. Children's dinner is served in the main restaurant at 6:30 p.m.
Kids Club in Legends (9 a.m. to 10 p.m.)
Three qualified hostesses entertain youngsters from 3 to 11 years old. For children under 3, a baby sitting service is also available on request, for a fee.
Children's lunch is served between 12:30 and 1:30 p.m. in the main restaurant or in the Kids Club depending on the day. The children have dinner in the main restaurant between 6:30 and 7:30 p.m.
Kids Club in Les Pavillons (9:30 a.m. to 10:00 p.m.)
Friendly, experienced, well-trained staff keep youngsters from 3 to 11 happy and occupied throughout the day and evening. Activities include:
*Learning the local dance, the Sega
*Gathering crabs on the beach by torchlight
*Making things and a whole host of indoor games
*Learning to play a traditional musical instrument
A special children's dinner is served from 6 p.m. to 7 p.m. Baby sitting service can also be provided, for a fee.
Kids Club in Diva
The ideal arrangement for both parents and their youngsters! Qualified staffs look after children aged from 3 to 11 from 9 a.m. to 10 p.m. daily and organize a whole range of activities to keep them busy and happy.
Children have dinner between 6 and 7 p.m. A baby sitting service is also available, for a fee.",high5051.txt
