,answers,options,questions,article,id
3,B,"['President Barack Obama is trying to stimulate economy', 'More and more people surf the Internet to ask for help from U .S .Government', ""The government's measures may create more than 1 00.000 jobs"", ""Former President Bush didn't encourage people to take public services.""]",Which one of the following is NOT TRUE'?,"As the economic crisis forces corporations and small businesses to shed jobs  , one large employer still has the ""help wanted "" sign out :the U.S .government
Experts say the federal governments' civilian workforce of 2.8 million is likely to expand significantly over the next several years as it aims at stimulating the economy , rescue troubled banks, _ health care and pursue other elements of President Barack Obama's agenda
With the economy in turmoil  the stability of a government career now holds greater appeal. And it doesn't hurt that the new boss, President,Barack Obama, has encouraged citizens to consider public service-a marked contrast to predecessor   George W. Bush who disparaged  government
""It's the same thing that happened 40-some-old years ago when Kennedy came in ""said Ross Harris whose Federal Research Service helps applicants find government jobs, ""It was a new generation and there was the same type of excitement behind it , and we're seeing the same type of thing with Obama""Harris said he has seen the number of unique visitors to his website double over the past year as the recession  has taken hold, He estimated that the $ 787 billion economic stimulus package signed into laws last month could create at least 100,000 more government jobs next year and 120,000 by 2012
Government hiring has increased steadily over the past four years, from 79,000 in the year 2004 to 99,000 in 2007 according to the Office of Personnel Management",high23174.txt
