,answers,options,questions,article,id
0,D,"['branch offices', 'churches', 'hospitals', 'organizations']",Hungry for Change and Oxfam are two_.,"Hungry for Change is part of a growing movement of people who want to stop  _ throughout the world . They want to make certain that people in famine areas can protect themselves from the effects of future droughts . They also want to make certain that enough help is quickly available for emergencies in all parts of the world .
Hungry for Change has helped to raise millions of pounds for famine relief   . It has attracted a great deal of newspaper publicity for its relief work . It has also been successful in persuading the government in prefix = st1 /Britainto increase its aid budget by several million pounds and carry out new research into improved crops . While Hungry for Change works in Britain for an end to poverty and famine in the world , Oxfam is helping to get over the fear of famine in such countries as Ethiopia and Sudan with long-term development projects .
In North West Darfur , Sudan , Oxfam is helping to increase food production .
In Nile Province,Sudan, Oxfam is planting trees in order to provide fuel and shelter , and to protect the soil . It is a faraway area , where rainfall is poor and conditions for agriculture and the forests are difficult .
In Arba Minch,Ethiopia, Oxfam is supporting a project to supply clean water to villages . Clean water will reduce the risk of diseases, especially among children .",high22974.txt
