,answers,options,questions,article,id
2,D,"['handbook', 'newspaper about match reviews', 'magazine about ball matches', 'notice']",You may find the passage most probably in a   _  .,"Central Sports Centre. City Road.
All Stars vs Rockets, Saturday 8: 30 p.m. $12
Northerners vs Tigers, Sunday noon $14
BUSHWALKING  :
Meet at Wanda Station, Saturday 9:00 a.m. sharp for 3-hour walk to Canary Mountains. $7, ph 341-5432 Meet at Westley Station, Sunday 9:00 a.m. sharp for a full day walk to Wombak Valley. $5, ph 341-8643. Bring your own lunch.
FOOTBALL:
St Martins Sports Centre
St Martins vs Doonsberg, Saturday 2:00 p.m. $8
Eastside Central vs Light Hill, Sunday 2:00 p.m. $8
Neill Park Recreation Centre
Neill Park vs Robinson, Saturday 2:00 p.m. $11
Essen vs Springwood, Sunday 2:00 p.m. $11
LAWN BOWLS :
Tans Town B.C
Tans Town vs White Vale, Saturday 9:00 p.m. $10
Wake Hill B.C.
Wake Hill vs Colls, Saturday 2: 00 p.m. $9",high7250.txt
