,answers,options,questions,article,id
1,A,"['more time', 'less time', 'more daytime', 'two hours']",French students usually spend   _   on homework than American students .,"Students often complain their teachers give them too much homework . Now , two reports show that in America this is not true .
The Brookings report shows that most students do less than one hour of homework . The Rand report shows that only 10% of high school students spend more than two hours a night on homework .
The Brookings report also talks about a study from 1995 . American students do almost the least homework among twenty countries . Students in France , Italy and South Africa spend more than two hours on homework .
The Rand report says there was only one time when homework greatly increased in America .During the early 1960s , Americans were not happy when the former Soviet Union  became the first country to reach space . People thought it was necessary to improve education .
Parents want their children to have time for sports , music lessons and other things after school. some experts say schools need to give useful homework .",high1132.txt
