,answers,options,questions,article,id
2,D,"['put the software on more than one computer', ""export the puzzles as PDF's style"", 'put puzzles on the web site', 'publish/sell the puzzles we create']",. This passage doesn't tell us if we can   _  .,"Try it and see for yourself--Crossword Weaver is the leading Crossword Puzzle Creator. This crossword puzzle maker, Crossword Weaver, is the leading crossword puzzle software. Type in your words to quickly create two styles of crossword puzzles.
The freeform style uses only your words. Perfect for educators, home scholars, parents, and anyone wanting their puzzle to use only their words. Or, our patented  technology mixes your words with a high quality database to give you professional puzzles in just seconds!
Education Discount--Get 25% Off! Teachers, parents, students, home scholars, and religious educators who are purchasing this product qualify for a 25% discount!
The demo  mode allows you to try the program to see if it meets your needs before you purchase it. After you purchase an unlocking code and enter the code into the Crossword Weaver demo, it will immediately become the full version. The demo version has limitations on printing, saving, and exporting.
Crossword Weaver is the best program for the best price.
Used by teachers, parents, puzzle lovers, businesses, newsletter editors, publishers, and newspapers all over the world!
Help your students learn vocabulary, spelling, facts, and more.
Easily add a puzzle to your newsletter to make it really special
Quickly make gifts for that special puzzle lover in your life.
New!Play your puzzles online or email to friends.
New!Save your puzzles as PDF's.
New!Easily export to a web site.
Try it for yourself and see how Crossword Weaver can help you with all of your crossword puzzle needs.
License number to unlock the demo                    $39.95
License number to unlock the demo plus the optional CD     $39.95 + $4.95 (includes S&H)
All upgrades are free. Simply download the demo for the new version and type in your unlock code again to get your new version.",high1339.txt
