,answers,options,questions,article,id
1,B,"['Standard Spoken English', 'Intermediate Business English', 'TOEFL Super Studies', ""Children's Weekend""]","If you work in a joint Venture  Company, you probably take the_course.","Part I
If you are hunting a chance to improve yourself in English, TOP ENGLISH CITY will be a smart choice. We are members of ""the International Language Workshop"" and enjoy both of the good honor in English teaching and high quality of our teaching team. We are devoted to providing affordable, excellent English training programs for those who want to improve both their English knowledge and their language skills.
In TOP ENGLISH CITY, you will be a top English-speaker among your competitors and enjoy the advantage that your competitors have not. You will be proud of being a member of TOP ENGLISH CITY.
Courses designed:
Basic Studies... Sat. 8:00-10:00 a. m.
Intermediate Spoken English... Sun. 8:00-10:00 a. m.
Standard Spoken English... Sat. 8:00-10:00 a.m.
Basic Business English... Sun.8:00-10:00 a.m.
Intermediate Business English... Sun. 7:00-9:00 p.m.
TOEFL Super Studies... Sun. 7:30-9:30 p.m.
Children's Weekend... Sat. &. Sun. 8:00 a.m. -5:00 p.m.
For more information, please contact:
Room 806 American Plaza Tianhexi Rd, 510150 Guangzhou
Tel: 86668888-8806
Part II
ENGLISH SALON
A place for you to practise your English, to exchange your English learning experiences, to know more about the culture of English-speaking countries, to make more friends who can speak very good English.
You will have free talks, famous English films and songs appreciation, English lectures and games; all are for you to improve yourself in English in the special, full-of-fun Salon.
How to Join:
We are a group with membership system, so if you want to join our group, please make an application to the Tianhe Office of Top English City, filling in the applying forms. You will be given a salon ID card, and becomes our member.
The Qualifications :
You must be fluent in English-speaking or / and an English lover. Those who are now learning English in the Top English City will be advantageous.
For more information, please contact:
Mr Jiu Chan           at: 47129198
English Salon, your best friend! Join Right Now!",high7478.txt
