,answers,options,questions,article,id
0,D,"['They are all weak at learning.', 'They are all disabled children.', 'They are all from rich families.', 'They are all from poor families.']",Which of the following correctly describes the pupils in Quito?,"Teach in nice and beautiful Ecuador ! The government school we work with has about 200 pupils aged from 5 to 14 years old. The children come from many different economic backgrounds and family situations. Some of the children are supported by the upper-class employers of their parents; others cannot attend school every day as they sell something in the streets for parts of the week.
This school really needs volunteers and you'll be greatly appreciated. You'll work with disadvantaged children who will benefit greatly from your help! You will be able to teach English and many other subjects--IT, sports, music, art, drama, anything you have a good knowledge in! Please let us know if you have a special interest and we will do our best to tailor-make   your project!
SUMMARY FACTFILE
Price: From PS775, excluding flights
Duration: From 2 weeks to 6 months subject to visa requirements
Start Dates: All year round--you choose your start and finish dates
Requirements: At least aged 17, no qualifications necessary, but you'll have to be enthusiastic. You'll need to know a little Spanish to do this project, but if you have no knowledge of Spanish at all, you can combine your project with 1-week intensive   Spanish course in Quito before starting your project.
WAHT YOU'LL GAIN FROM DOING THIS PROJECT:
* An exciting, never-to-be-forgotten adventure in the fascinating culture of Ecuador
* The great satisfaction of helping disadvantaged children and adults and knowing that you made a difference to them
* New skills, more confidence, a greater understanding of a different culture, invaluable personal and professional development 
* An entry on your CV that makes you stand head and shoulders above others in the job market
* And best of all...an unforgettable experience!",high18900.txt
