,answers,options,questions,article,id
2,B,"['focus on your own interests', 'adjust your study schedules', 'get any help from instructors', 'keep up with new techniques']","If you take the courses at home, you are more likely to   _  .","What Is Natural Medicine
Natural Medicine is to use the natural environment, the nature of the material itself to cure diseases and restore the health.It involves bettering one's breathing way, sunbathing, improving one's diets and so on, which play an important part in our healthcare.
Start a Rewarding Career Today
The Australian Institute of Applied Sciences College of Natural Medicine provides you with Nationally Recognized natural medicine courses that can be studied in the comfort of your own home, or at our Brisbane campus in the heart of Stones Corner.AIAS College of Natural Medicine has been providing accredited   natural health courses for more than 20 years, and offers accredited certificate, diploma and advanced diploma level natural medicine, beauty and massage   courses.
Why Study at the Australian Institute of Applied Sciences
With over 36 years of specialized training and 120 courses, our Natural Medicine College is Australia's longest running and most sought after training provider for Natural Medicine Education.Our state of the art facilities, highly experienced instructors and friendly support staff make us the first choice for Distance Education and On-campus study.
Studying at Home
All of our courses are available to study at home.We provide all the material and support you will need to successfully complete your course.
Benefits of Studying at Home
*Work at your own pace.
*No need to travel or relocate closer to a campus.
*No interruption to your existing commitments.
*You are still in full contact with the college via Telephone, Email and Post, so you won't be out of touch with the latest training techniques.",high10797.txt
