,answers,options,questions,article,id
2,A,"['Jefferson was an amusing talker, but not good at speaking in public.', 'Jefferson was not an easy person to get along with.', 'Jefferson was not only very talented but also very handsome.', 'Not being politically minded, Jefferson never vetoed a bill passed by the Congress.']",Which of the following statements is TRUE?,"As we all know, it was Thomas Jefferson who wrote the Declaration of Independence (<<>> ). He wrote it in two weeks, and after a few changes, it was accepted by the Congress  . As a result, he became famous.
Born in 1743 in Virginia, Thomas Jefferson, a wonderful student at school and almost talented( ) lawyer later, was much interested in politics.
Jefferson was elected the Governor of Virginia in 1779, and he was sent to France as the representative of the American government in 1784. Sixteen years later, at the age of 57, he was elected president after Washington and Adams.
Far from a handsome man, he was tall with long arms and big hands. Jefferson, who was an amusing  talker in conversation but a poor speaker, was generally good-natured.
Jefferson was regarded as a defender of freedom in America. As a president, he protected the right of free speech. Interestingly enough, in his eight years as president, Jefferson never vetoed   a bill which the Congress had passed. He did a lot in organizing the new University of Virginia.
Thomas Jefferson died on July the fourth, 1826, the fiftieth anniversary of American Independence.",high10743.txt
