,answers,options,questions,article,id
1,A,"['2 Fridays per month', '12:00-12:30 or 12:30-1:00, Saturday afternoon', '4:00-5:00 pm, Wednesday', '4:30-5:30 pm, Tuesday']",Activities on how to lead to a better understanding of friendships are held   _  .,"Friends and Buddies
This program is planned for teenagers who have special needs with the goal of meeting within a community with other peers . The purpose of the program is that it will lead to a better understanding of friendships. Gym, Swim, Surprise Guest, and Pizza are included. Ages 12-18, numbers of members are limited. Contact: Gloria Bass. This program is held 2 Fridays per month. Fees: $65/$85
Club Saturday Swim
This program is available to anyone aged 5-14 who is challenged by mental, physical, or emotional trouble. The program will be held each Saturday afternoon, 12:00-12:30 pm or 12:30-1:00 pm. Fees: $136/$260
Sibshops (Ages 10-13)
Sibshops is a program for siblings  of children with challenges. It includes group activities and talk treatment ways with the focus on improving sibling relationships and whole family happiness. Location: Hope Church, Wilton CT. Wednesday: 4:00-5:00 pm. Fees: $50/$65
Banana Splits
Banana Splits is an educational support group for children in family trouble. Children aged 9-13 will have the opportunity to meet other children whose parents have separated or divorced, learn to recognize feelings, think of healthy coping skills and have a place to share their struggles through verbal , physical, and artistic experiences. Location: Hope Church, Wilton CT. Tuesday:4:30-5:30 pm. Fees: $50/$65",high11730.txt
