,answers,options,questions,article,id
2,A,"['may develop faster because of the challenge of ""Shanzhai"" culture', 'is the challenge of ""Shanzhai"" culture', 'will be replaced by ""Shanzhai"" culture', 'is held back by ""Shanzhai"" culture']",We can infer that the mainstream culture   _  .,"The Chinese word ""Shanzhai"" means a small mountain village, but now it becomes an accepted name for fakes  , after ""Shanzhai Cell-phones"" produced by small workshops in southern China became popular in the mainland market over the past two years.
Besides ""Shanzhai"" electronic products, there are ""Shanzhai"" movies, ""Shanzhai"" stars and even a ""Shanzhai"" Spring Festival Gala  , a copy of the 25-year-old traditional show presented by CCTV on Chinese Lunar New Year's Eve.
""Shanzhai"" has become a culture of its own, meaning anything that imitates something famous.
In Chongqing, ""Shanzhai"" version ""Bird's Nest"" and ""Water Cube"" woven by farmers with bamboo attract wide attention from tourists. Both are copies of the famous Olympic buildings in Beijing.
A literature critic said that taking the ""Shanzhai"" Gala as an example, when the traditional CCTV program becomes less and less attractive to the audience, the""Shanzhai"" version appears timely to attract people. ""Although it is often connected with poor techniques and operation, 'Shanzhai' culture meets the psychological needs of common people and could be a comfort to their minds,"" he said.
To the mainstream   culture, the rise of ""Shanzhai"" culture is a challenge and a motivation  . People believe different kinds of cultures developing together is a perfect situation and it is for the public to choose.",high3853.txt
