,answers,options,questions,article,id
1,B,"['tell us the function   of a diary', 'call on us to love our parents', 'teach us what a crow is', 'introduce a pair of son and father']",The writer mainly intends to   _   .,"An 80-year-old man was sitting on the sofa in his house along with his 45-year-old son. Suddenly a crow   landed on their window.
The father asked his son, ""What is that?""
The son replied, ""That is a crow.""
After a few minutes, the father asked his son for the second time, ""What is this?""
The son said, ""Father, I told you just now. It's a crow.""
After a little while, the father asked his son the same question for the third time, ""What is this?""
This time, the son said to his father in a low and cold tone, ""It's a crow, a crow.""
After a moment, the father yet again asked his son for the fourth time, ""What is this?""
This time his son shouted at his father, ""Why do you keep asking me the same question again and again? I have told you already, 'IT IS A CROW'. Are you not able to understand this?""
A minute later the father went to his room and came back with a diary, which he had kept since his son was born. On opening a page, he asked his son to read that page.
Today my little son aged three was sitting with me on the sofa when a crow suddenly landed on the window edge. My son asked me 23 times what it was, and I replied him 23 times that it was a crow. I hugged him lovingly each time he asked me the same question. I didn't at all feel angry, but instead felt _ for my son.
If your parents reach old age, do not look at them as a burden, but speak to them gently, and be kind to them. From today say this aloud, ""I want to see my parents happy forever. They have cared for me ever since I was a little child. They have always showered me with love. I will take care of my old parents in the best way no matter how they behave.""",high968.txt
