,answers,options,questions,article,id
0,B,"['a storybook', 'a newspaper', 'a magazine', 'a textbook']",This passage is probably taken from   _  .,"More than 10,000 people were made homeless in Ternang when the Sungai Mas overflowed its banks yesterday after six days of continuous heavy rain.
The wooden bridge across the river has been washed away. The town is cut off by flood waters. At the fifth mile, Jalan Tengkn, the water is two meters deep. It is closed to all traffic. Flooding first happened at mid-afternoon yesterday along the river banks. People trying to get to higher ground were just in time to escape the destroying of the flood. Most of the flood victims   had to leave all their things behind.
The National Flood Relief   Center was reported to give its help and by early evening the whole town was moved out, helped by the army, police, Red Cross Society and volunteers  .
The flood victims are now housed in different simple relief centers in the nearby town of Ternang. ""Everything possible is being done to help the unlucky people,"" a government spokesman said, ""In fact, money, food and clothing have begun to come in from public organizations and helpful people. A Disaster Relief Fund   will be started as soon as possible.""
According to the latest reports it is still raining heavily at Ternang. The whole town is expected to be wholly covered by the water. So far no deaths have been reported.",high12959.txt
