,answers,options,questions,article,id
1,B,"['talk about touring experiences', 'attract people to the tour', 'talk about the history of Africa', 'introduce places of interest in Africa']",The passage is written to   _  .[,"This wonderful 16-day tour is designed to highlight South Africa's amazing diversity of cultures, its curious mixture of old and new, as well as its wonderful scenery and wildlife, together with its unique history.
Join us to experience Cape Town and the exciting Kruger safari   on our tour to South AfricA. We believe that a more naturally beautiful country than South Africa would be difficult to find: from the rocky peaks of the Drakensberg Mountains, to the timeless semi-desert landscapes of the Karoo and then the forested seashores and mirror-like lakes of the Garden Route, the attractive valleys of the Winelands and the symbol of the country, Table Mountain -- all under an endless blue sky.Quite amazing!
Included in our price:
Return flights from London Heathrow
Three-and-four-star hotels, sharing rooms, breakfast and lunch included
Internal flight to the beautiful Garden Route
Full-day guided safari in the Kruger National Park
Visit the legendary Zulu War battlefields of Isandlwana, Rorke's Drift, the historical Cape of Good Hope, Cape Town, Apartheid Museum and Blyde River Canyon
Travel on Outeniqua steam train or go whale watching depending on the season
For more information, call 0845 155 6706.",high11746.txt
