,answers,options,questions,article,id
2,B,"['Darwin Centre.', 'The Great Debate School Program.', 'Self-led Activities.', 'Hands-on Activities.']",Which of the following programs is the most suitable one for team work?,"School Activities
Our school activities are suitable for all ages and levels including primary, secondary and A-Level. We offer workshops, hands-on activities and a teacher support service to help you get the most out of your visit. All school services are free, but must be booked in advance.[:Z,xx,k.Com]
Darwin Centre
Find out who you really are and where you come from in our interactive films about evolution, described by Sir David Attenborough.
Hands-on Activities
Get up close and personal with Museum in these hands-on activities, where you can handle real specimens from our collections. Hundreds of real, natural history specimens for students to touch and explore are in our hands-on science centre.
Self-led Activities
Pupils can engage with specimens through role-play in a self-guided explorer challenge through the Museum.
The Great Debate School Program
Students are introduced to the history of the debate during a lively tour. They are then divided into groups and use exhibits to prepare presentations representing the views of the debated key characters.
Booking
All school activities must be booked in advance by calling the schools booking line: 4420 7942 6666.",high10521.txt
