,answers,options,questions,article,id
2,A,"['include vitamin and mineral supplements.', 'are applied to keep the hair healthy.', 'have been proved useful.', 'are the most commonly-used ways.']",The natural treatments   _  .,"There are several reasons for hair loss in women. However, in most cases, treatment is quite effective. Female hair loss patterns in women are not as easily recognizable as they are in men. A woman may experience it temporarily due to pregnancy or illness, although they may experience it for other reasons.
Hair loss can be due to a variety of factors, including a genetic tendency (which is not genetically linked to just one parent--both parents contribute to the tendency to lose hair).
Women who are experiencing hair problems seem to have more limited choices than men. There are some female hair loss treatments that are available such as the Tricomin System which is a topical treatment that is nutrition based. Shen Min for Women is another natural treatment that contains herbs   that are said to stimulate  hair growth and even restore hair that is graying to its natural color1.
The majority of the popular, prove hair loss treatments are only intended for men and are not suitable for women. True, a woman's hair issue is different from a man's. The biological makeup is different and the needs are different. Women have different needs and their bodies react in different ways to environmental changes, physical illness and even the treatments that are available. There are many natural treatments such as vitamin and mineral supplements that are said to stimulate hair growth, but, for the most part, these claims are currently unproven.
One of the first and most important factors to effectively treating is to get a diagnosis from a doctor. Talk to your doctor about any symptoms  that you may be experiencing in addition to the thinning hair. Stress, weight loss or gain, illness and depression, all of these can be contributing factors.",high19020.txt
