,answers,options,questions,article,id
3,A,"['China expect closer ties between China and the U.S. and Western Europe.', 'They want to travel abroad', 'They need a rest', 'They are seeking for an opportunity to work abroad.']",What is the purpose for China scientists to visit ten nations next month?,"This is news on the Hour. Ed Wilson is reporting. The President and First Lady will visit Africa on a goodwill tour in May. They plan to visit eight African countries.
Reports from China say the Chinese want closer ties between China and the U.S. and Western Europe. A group of top China scientists starts its ten-nation tour next month.
Here in Milmi, the mayor is still meeting with the leaders of the teachers' union to try to find a way to end the strike. City schools are still closed after two weeks.
In news about health, scientists in California report findings of relationship between the drinking of coffee and the increase of heart disease among woman. According to the report in the American Medical Journal, the five-year study shows this: women who drink more than two cups of coffee a day have a greater chance of having heart disease than women who do not.
In sports, the Chargers lost again last night. The BBS beat them one to nothing. The Wingers had better results. They beat the Rifles 7 to 3.It was their first win in their five matches.
That the news of the Hour. And now back to more easy listening with Jan Singer.",high7523.txt
