,answers,options,questions,article,id
2,B,"['Two students of HUST committed suicide.', ""What can we do to prevent the student's suicide?"", 'The reasons why the students committed suicide.', 'The dangers in the universities in China.']",What's the main idea of the passage?,"It's a nightmare for Huazhong University of Science and Technology (HUST): within a week,two students committed suicide by jumping off dorm buildings.,:,. 
Officials from the university are _ to give interviews.. 
""We had a hard time calming down students who were shocked at the suicides,"" said Zhang Jingyuan,one official of HUST.
""Media coverage may arouse some students' negative emotions again.Suicide can be contagious,"" Zhang said.,"",. ""
The university reacted promptly to the first suicide on October 23.1023,. 
Advisors and class leaders conducted dorm-to-dorm checks to find students suffering depression.Then psychologists offered one-on-one counseling to them.,. ,. 
Notice boards publicizing tips for identifying peers' mental problems and offering help were set up in front of dorm buildings.Leaflets carrying similar information were handed out to each dorm.,. . 
However,the second suicide came seven days later.,,. 
Both students were described as men of few words.Their schoolmates didn't see anything to indicate suicide.,. . 
Zhang revealed that the two students had been bothered by mental disorders.But the school didn't know this until the students' close friends outside school and their parents unveiled the truth after the suicides.,. ,. 
According to Zhang,there are only three full-time counselors working in the university's counseling center for its 60,000 students.He complained: ""It's unrealistic to rely only on counselors to detect students' mental problems."",,. :"",. ""
Effective prevention comes from long-term education for life instead of temporary intervention to meet an emergency,said Hu Yi'an.Hu delivers a course of lectures on life and death at Guangzhou University.He worries that universities have paid little attention to education for life.,, . . . 
""Education for life helps students respect and love life so they won't resort to ending their lives when they have difficulties,"" said Hu."", ,,,"" . 
According to Hu,the principles can be incorporated into everyday teaching.,. 
Hu is also concerned that some universities are conveying discriminatory message that will hold back students from seeking help.. 
When HUST conducted the dorm-to-dorm examination,students with poor academic performance were paid special attention.In March,Peking University also released a controversial policy,which required teachers to have a chat with students ""with biased thinking"".,. ,,"""". 
However,Hu suggested that students step out of their comfort zone to seek real-life communication.",high1009.txt
