,answers,options,questions,article,id
2,D,"['2', '4', '5', '6']","If a student plans to take the course, he has to arrive in Bingham at least   _   days in advance before term starts.","International Students' Orientation Programme
What is it?
It is a course which will introduce you to the College and to Bingham. It takes place in the week before term starts, from 24th-28thSeptember, but you should plan to arrive in Bingham on the 22ndor 23rdSeptember.
Why do we think it is important?
We want you to have the best possible start to your studies and you need to find out about all the opportunities that college life offers. It will enable you to get to know the college, its facilities and services. You will also have a chance to meet staff and students.
How much will it cost?
* International students (non-European Union students)
For those students who do not come from European Union (EU) countries, and who are not used to European culture and customs, the progamme is very important and you are strongly advised to attend. Because of this, the cost of the programme, without accommodation, is built into your tuition fees.
* EU students
EU students are welcome to take part in this programme without accommodation for PS195.
Accommodation costs (international and EU students)
The cost of accommodation for one week is PS165
If you have booked accommodation for the year ahead (41 weeks) through the college, you do not have to pay extra for accommodation. You can ask us to pre-book accommodation for you one week only in a hotel with other International students.
What is included during the programme?
Meals: lunch and an evening meal are provided as part of the programme. Please note that breakfast is not available.
Information: including such topics as accommodation, health, religious matters, study skills, and other necessary information.
Social activities: including a welcome party and a half day trip round Bingham.",high12450.txt
