,answers,options,questions,article,id
1,D,"['had a lot of fun', 'were found missing', 'lost their lives', 'became seriously ill']",After visiting Disneyland some people   _  .,"People from all over the world visit Disneyland to have fun, not to get sick. But last week, an outbreak of measles spread from the Southern California theme park. As of Monday, January 19, at least 52 people have got the easily spread illness.
The majority of the reported cases of measles are from people who visited the park before. According to the California Department of Public Health, these people were exposed to the illness at Disneyland from December 17-20.
Officials believe the cause is likely someone who caught measles abroad and visited Disneyland, but this has yet to be proved. However, in 2014, California had its highest measles infection rate in nearly twenty years. There were 66 cases of measles reported in the state--23 of them in Orange County, where Disneyland is located.
Measles spreads very easily. It can be caught from coughing and sneezing. Crowded areas like theme parks are especially suitable for its spread.
The illness starts with a fever and develops into symptoms including a cough, runny nose, red eyes and so on. About three out of ten people infected with measles will develop another health problem, including an ear infection or pneumonia .
The best way to _ measles is to get vaccinated . An unvaccinated person is 35 times more likely to catch measles than someone who received a vaccination.",high13990.txt
