,answers,options,questions,article,id
0,A,"['School students.', 'Cambridge locals.', 'CSF winners.', 'MIT artists.']",Who can take part in the Curiosity Challenge?,"The Cambridge Science Festival Curiosity Challenge
Dare to Take the Curiosity Challenge!
The Cambridge Science Festival (CSF) is pleased to inform you of the sixth annual Curiosity Challenge. The challenge invites, even dares school students between the ages of 5 and 14 to create artwork or a piece of writing that shows their curiosity and how it inspires them to explore their world.
Students are being dared to draw a picture, write an article, take a photo or write a poem that shows what they are curious about. To enter the challenge, all artwork or pieces of writing should be sent to the Cambridge Science Festival, MIT Museum, 265 Mass Avenue, Cambridge 02139 by Friday, February 8th.
Students who enter the Curiosity Challenge and are selected as winners will be honored at a special ceremony during the CSF on Sunday, April 21st. Guest speakers will also present prizes to the students. Winning entries will be published in a book. Student entries will be exhibited and prizes will be given. Families of those who take part will be included in the celebration and brunch will be served.
Between March 10th and March 15th, each winner will be given the specifics of the closing ceremony and the Curiosity Challenge celebration. The program guidelines and other related information are available at: http://cambridgesciencefestival.org.",high13969.txt
