,answers,options,questions,article,id
3,A,"[""Danish babies' names should be on the list if parents can't get the permission."", 'Each year about 150-200 reviewed names are rejected in Denmark.', 'Adolf Hitler is banned in Iceland.', ""Parents should pay a fee for babies' names if the names are rejected.""]","According to the passage, which of the following is true?","Strange Baby-Naming Laws
Germany Parents are banned by law from using last names and the names of objects and products as first names. A child's first name must clearly indicate his or her sex, and all names must be approved by the office of vital statistics in the area in which the child was born.
Iceland The country's naming committee consults the National Register of Persons to determine if a name is acceptable. If parents want to go off-list, they must apply for approval and pay a fee, and the name must contain only letters in the Icelandic alphabet.
New Zealand The country's Births, Deaths, and Marriages Registration Act of 1995 prohibits parents from choosing a name that "" might cause offense to a reasonable person; is unreasonably long; or is, includes, or resembles an official title or rank,"" including, apparently, Adolf Hitler and Yeah Detroit--both names recently rejected.
Denmark If Danish parents prefer a moniker not on the list of 7,000 preapproved baby names, they must get permission from local church and government officials. Fifteen to 20 percent of the 1,100 reviewed names--including creative spellings of common names, last names as first names, and unusual names--are rejected each year.",high4280.txt
