,answers,options,questions,article,id
2,D,"['5. 00 PM', '5. 30 PM', '7. 05 PM', '7. 30 PM']",We can infer from the passage that the ending time of the tour is   _  .,"Our guide was excellent! He walked us through all the local villages and took extra time at the end to enjoy a local dinner. He stayed with us longer than he was obliged  to and made this a fantastic experience.
Tour _ 
Travel is all about the street food these days, and why not? It's fresh, fast, cheap and a great way to crack into the local scene. Join this Hanoi tour to source the best street eats from markets, food carts, street cafes and other hard-to-find-but-totally-worth-the-effort secret spots.
Highlights
Sample delicious Vietnamese cuisine just like the locals do -- on the street
Stroll through hidden alleyways and bustling markets of Hanoi's charming old quarter
Learn more about Hanoi's unique food culture
Try local specialties with influences from French and Chinese cuisine
Take in a spectacular night view of Hoan Kiem lake from a secret cafe
Schedule details
Duration: 2.5 hours
Meeting point: Sacombank ATM Machine - No. 1 Dong Xuan street (front entrance of Dong Xuan Market, Corner of Dong Xuan St with Cau Dong St)
Starting time: 5. 00 PM
Ending point: Cafe Pho Co - 11 Hang Gai St, Hoan Kiem",high13154.txt
