,answers,options,questions,article,id
0,A,"['Because they want gum to cure some diseases.', 'Because they wish people to become addictive to it.', 'Because they plan to make gum more tasteful.', 'Because they hope to make gum good for teeth.']",Why are companies trying to put medicines into gum?,"Most schools ban chewing gum,but in a few years they might consider changing that rule.Why? Scientists are finding evidence that gum chewing may be good for your health.It may even help boost your test scores.
This exciting research is just beginning.And in the meantime,companies are also experimenting with adding vitamins,minerals,medicines,and other substances that could give gum the power to cure headaches and fight everything from serious diseases to bad breath.
People have been chewing gum for thousands of years.Ancient Greeks,Mayas,and Native Americans,for example,chewed on the sap,or resin of certain types of trees.Today gum is a litde more complicated.Gum manufacturers start by mixing resin,wax,and a molecule called polyvinyl acetate to make a gum base.By varying the types and amounts of these ingredients,scientists can make thousands of formulations.
Just what can gum do for your health?Many studies show that chewing gum after meals fights cavities by stimulating the production of saliva.Saliva helps wash away bacteria that damage our teeth.An ingredient called xylitol,which is added to it,provides an extra dose of cavity-fighting power.This is good for more than just the teeth.Research suggests that good oral health decreases the risk of heart disease,and other serious diseases.
Chewing gum might also be good for your brain.Chewing gum boosts the flow of blood to participants'brains by 40 percent.
But too much chewing can damage the jaw joint.And chewing too much of gum that contains vitamins,caffeine,or a medicine could lead to an overdose.What's a more,no matter how healthy gum chewing proves to be,it will never be a match for a healthy lifestyle.
Nothing like gum or a vitamin is going to cure a bad dietary habit or a bad exercise habit;it's not a magic bullet.",high17461.txt
