,answers,options,questions,article,id
2,C,"['Cats.', 'Bats.', 'Wombats.', 'Ants.']",Which of the following animals use dust to clean themselves?,"To wash yourself, you take a bath  or a shower. Animals need to keep clean, too. How do animals clean themselves?
Cats
 themselves to keep their fur clean. Have you ever watched a pet cat clean itself?
Elephants take baths much as you do. But instead of jumping into the
 , they walk into a river or lake.
Pigs also like to roll around in water. This keeps them clean and cool. If there is no clean water, they will roll in
 on a hot day. They do this to cool off. Pigs do not really like mud. They are happier in a nice, clean pond .
Bats have a funny way to keep clean. They lick their thumbs to clean their ears!
Guess how polar bears clean themselves. They use snow, of course!
Some animals take baths in dust instead of water! The wombat  is an Australian animal with lots of fur. To get clean, it lies down. Then it covers itself with sand!
Birds clean themselves in many ways. Sometimes they wash in water. That's why some people put birdbaths in their yard. At other times birds take dust baths, just like wombats. Birds also use their
 to keep their feathers clean. They use their beaks the way you use a comb.
Sometimes a bird has
 in its feathers. Birds may use ants to help them clean off the bugs. A bird will lie down on an ant nest. Then the ants will crawl on the bird. The ants make a kind of bug
 on the feathers;. Then the itchy bugs die!
Birds take baths in something else besides dust and ants! Some birds take ""smoke baths"" They sit on chimneys. They wave their wings in the smoke!",high16011.txt
