,answers,options,questions,article,id
2,C,"['$1380', 'over $1380', 'much less than $1380', 'nothing']","If you go there for one term course, you will pay    _    for it.","Sheffield
Lincoln College of English
Classes for foreign students at all levels 3 months, 6 months, 9 months and one course open all year.
Small class (maximum 12 students), library, language lab and listening center,
accommodations with selected families 25 minutes from London.
Course fees for English for one year are $1380 with reduction for shorter periods of study.",high16133.txt
