,answers,options,questions,article,id
0,B,"['They help to improve your memory.', 'They help you to read much faster.', 'They offer you the latest ideas.', 'They include many tests.']",What do Triple Your Reading Speed and The Memory Book have in common?,"As We Speak
by Peter Meyers, Shann Nix
The world is full of brilliant people whose ideas are never heard. This book is designed to make sure that you're not one of them. Whether you are speaking to a large audience or in a one-on-one conversation, the way in which you communicate ideas, as much as the ideas themselves, can determine success or failure. In this invaluable guide, you'll learn to master principles that you can apply in a wide variety of situations.
Triple Your Reading Speed
by Wade E.Cutler
This fourth edition of the book does just that--with tests that make it fun and simple to acquire the skills that will give you an advantage in school and on the job. The method helps you to break old habits that may be slowing you down, and develop strategies for increased comprehension in less time.
The Memory Book
by Harry Lorayne, Jerry Lucas
Unlock the hidden power of your mind through Harry Lorayne and Jerry Lucas's simple memory system, and you can become more effective and more powerful. Discover how easy it is to remember things; learn foreign words with ease; read with speed and greater understanding; shine in the classroom and shorten study hours.
How to Become a Straight-A student
by Cal Newport
Most college students believe that straight A's can be achieved only through cramming  and painful all-nighters at the library. But Cal Newport knows that real straight-A students don't study harder--they study smarter. A breakthrough approach to completing academic tasks very well, How to Become a Straight-A student reveals for the first time the proven study secrets of real straight-A students across the country and turns them into a simple, practical system that anyone can master.",high10718.txt
