,answers,options,questions,article,id
3,D,"['buy a leaflet', 'write enclosing a stamped, addressed envelope', 'sign a contract', 'phone at any time of day or night']",In order to find out more information about this alarm system one can   _  .,"Are you worried by the rising crime rate? If you are, you probably know that your house, possessions  and person are increasingly in danger of suffering from great rise in the cases of burglary(;) and attack.
Figures show an ever-increasing crime rate, but it is only too easy to imagine ""It will never happen to me"". Unfortunately, statistics show that it really can happen to you and, if you live in a large city, you run twice the risk of being a victim.
Fortunately, there is something definite which you can do. Protect Alarms can help to protect your house with a burglar alarm system  which is effective, simple to operate and easily affordable.
You must remember that owning a burglar alarm is no indication  that your house is packed with valuable possessions. It quite simply indicates to unwelcome visitors that yours is one house they will not break into easily, so they carry on to an unprotected house where their job is made a lot easier.
Send now for our free leaflet  telling you how we can Protect Alarm your house quickly, easily and cheaply. Complete and tear off the slip below and post it to us. Postage is free. Also, telephone us on 327 6721 where we have a round-the-clock answering service. It costs nothing to find out about Protect Alarm.",high1317.txt
