,answers,options,questions,article,id
2,A,"['tell us the earthquake taking place in Yunnan has caused 5,000 homeless', 'warn the people in mountainous areas in Yunnan to take care of earthquake', 'call on more help from the people all over the country', 'analyze why the earthquake took place in this area']",The author's purpose in writing the passage is to  _  .,"China Earthquake Leaves 5,000 Homeless
Beijing--An earthquake measuring 5.8 on the Richter scale left 5,000 people homeless, killed at least one person and injured 39 others in southwest China on Thursday, with more accidents expected.
By late Thursday, 4,900 people were declared homeless after the quake destroyed their homes in a mountainous area lying on the border between Yunnan and Sichuan provinces. The dawn quake left one dead and 39 injured, destroyed 268 houses and damaged 1,132 other buildings so seriously that they were considered uninhabitable  .
Another 2,400 houses suffered less serious damage. The center of the earthquake was near the scenic Lugu Lake, a tourist place, where the local school was badly damaged.
In the beginning people thought that the economic losses would add up to about 180 million yuan (22 million dollars).
Governments in Yanyuan and the neighboring Yunnan country of Ninglang have joined forces in the rescue efforts and tents, clothes and medicine are badly in need of for the earthquake victims.
The mountainous place, heavy rain and several aftershocks all prevented rescue efforts on Thursday. The rain could cause more badly damaged homes to fall down.
More dead and injured are expected"" as rescuers have yet to reach many faraway areas"". It is very hard for rescue workers because most houses are scattered around the mountains, which are inhabited by Yi and other ethnic minority groups .
The quake hit the area at 5:10 a.m. Beijing time (2,110 Wednesday GMT).Earthquakes regularly affect  _ , with two quakes measuring 5.0 and 6.2 on the Richter scale killing at least three people and injuring more than 1,500 in Ninglang in November 1998.
The area is about 100 kilometers from the historic Yunnan town of Lijiang, which was struck in 1996 by an earthquake that killed more than 250 people and injured 14,000.
(Reports from China Daily,May 25,2001)",high22759.txt
