,answers,options,questions,article,id
3,D,"['plants; earth', 'a food chain; sun', 'food; sun', 'plants; star']",All the food we eat comes from   _  . And it starts with the   _  .,"The sun is a huge, hot, bright star. It is important because without it there would be no life on Earth. The sun gives us light and heat.
  All living things need light and heat from the sun to live. Plants need light and heat to grow. They use the light from the sun to make food. We cannot make our own food, but plants can. All the food we eat comes from plants in a food chain which starts with the sun. For example, 
  Animals need sunlight, too. Just like us, their food comes from a food chain which begins with the sun and the plants.
  sun- leaf- caterpillar -bird 
  sun- seaweed -small fish- whale  
  Sunlight means we can see during the day. If there was no sun, it would be dark all the time. Even when the sky is cloudy, the sunlight is very strong and it shines through the clouds.",high20235.txt
