,answers,options,questions,article,id
2,C,"['in real shops', 'by telephone', 'on the Internet', 'in supermarkets']",Standard Phone Case can be bought   _  .,"According to the National Retail Federation, we spend a record of $18.6 billion on Mother's Day gifts every year that works out to about $152 per mom. If you're looking to step up your gift-giving game, here are a few fun ideas. Of course, your mom will love you no matter what, but a nice gift wouldn't hurt!
J. Crew's Poppy King Lipstick, $18.00
Bright color1s are the trend for summer. But if your mom isn't ready for a head-to-toe Technicolor1   look, she can still be on trend with J. Crew's Poppy King lipstick. Called as the ""perfect shade"" for all skin types, the bright coral is sure to bring a smile to her lips.
Standard Phone Case, $ 30. 00
A color1ful case for mom's phone is in fashion and practical. Boutiqueme. net offers a variety of styles and color1s including several ones which can be ""mom-o-grammed"" with her initials .
NOOK Simple Touch With GlowLight, $139.00
In recognition of all the bedtime stories she read to you, why not give mom the perfect e-reader for reading in bed? The NOOK Simple Touch With GlowLight is the first and only e-reader designed specifically for reading in bed.
Then Again, by Diane Keaton, published by Random House, $ 26. 00 hardcover/$16. 00 paperback
Then Again, a memoir  from actress Diane Keaton, is her version of I Remember Mama.
One reviewer says that it is a ""far-reaching, heartbreaking,  ly easily understandable book about mothers, daughters, childhood, aging, joyfulness, love, work.., and show business, too.""",high19750.txt
