,answers,options,questions,article,id
1,D,"['eye problems', 'weight problems', 'lack of creativity', 'lack of interest in their lessons']",Children who watch TV or surf the Internet too much may suffer all the following EXCEPT .,"Dr. Julie Coulton, a British psychologist, focuses her research on the extraordinary function of the play in the physical and spiritual development of children and Martti Bergson from the University of Helsinki shows that playing outside, in the open air, contributes to a better development of the brain.
Thus parents must encourage their children to spend as much time as possible in the open air, and at the same time, to ask schools and kindergartens to assure the small a playground outside. Recent statistics   and studies show an alarming increase of the number of hours spent by children in front of the TV and the computer and a decrease of the time spent outside.
As a consequence more and more children suffer from eye problems and have to wear glasses. Also the problem of fatness among children concerns many parents who don't know what to do anymore to make their children eat healthy and balanced.
Children need a space where to develop their creativity mid parents should encourage them all the time. Too many rules hold back the child's personality and creativity and prevent them to develop the desire to know, to find out, to learn.
If you tell your child so many times: ""Don't do that, don't mess the room, don't go there ..."", he will lose the desire to do something, anything. Parents must watch their children without suffocating   them. Should you consider they mustn't do that or this, you have to logically explain them your reasons and they will understand.
Through playing a child learns how to communicate, how to take decisions. Playing is connected to the intellectual, emotional and social progress of the child. Playing lets your children learn how to express his feelings.",high15540.txt
