,answers,options,questions,article,id
0,D,"['Eat less and take more exercise.', 'Have less for lunch.', 'Have more for supper.', 'Have a good breakfast.']",What should adults do in order to keep good health?,"One of the most important meals of the day is breakfast. In order for children to build strong bodies and for adults to keep well, they should always eat a good breakfast. Eating the right food is necessary for good health. You should eat different kinds of food in order to keep a good health.
It is understood that a good breakfast may contain eggs, bread, milk, and so on. By eating breakfast every morning, you can feel alive and active in the morning's work. After a good breakfast you can step out into the morning air and feel wonderful. Anybody can feel better by eating a good breakfast.
Many fathers and mothers are unable to get their children to eat breakfast. There are many reasons for children not to eat breakfast. One reason could be that they do not have a good example. It could be that the father and mother do not eat breakfast. What ever the reasons are for children not to eat breakfast, it can be bad for their health.
Without breakfast children may not grow as fast as they should and may not study and play as well in school in the morning as they could. They can have more illnesses, and, when they are ill, it may take them longer to be in good health again than it takes children with good health habits.
Good eating habits mean eating breakfast. Unless you eat breakfast, you do not eat a full meal from dinner the night before until lunch the next day. This is quite a long time for the body to go without food.
Food is the source of power for the body. Unless the body gets food, it cannot keep operating at top speed. Without food the body will slow down. Nobody will live without food. It is necessary to start the day full of power. So you must eat breakfast so that you can keep in good health and do your best each morning.",high2006.txt
