,answers,options,questions,article,id
3,D,"['Sports and extremes.', 'Excitement and freedom.', 'Dreams and success.', 'Self-confidence and freedom.']",Which of the following is the philosophy of park-our?,"It started off as part of French military training and has since evolved as a sport, founded by Sebastian Foucan and David Belle, to encompass a wide variety of techniques, philosophies and exercises. Park-our now enjoys the devotion of many die-hard fans across the world and has been the source for much inspiration.
But what is park-our? It is the art of using only your body to navigate from Point A to B in the least time possible, which involves besides leaping, climbing and sprinting, various unusual and complex movements to overcome barriers. Just like the James Bond in the movie Casino Royale? Bond jumps down from a roof to a windowsill and then runs several blocks over _ on the way. It is just because of Bond's wonderful performances that the sport has become popular worldwide.
Yes, that's pork-our, an extreme street sport aimed at moving from one point to another as quickly as possible, getting over all the obstacles in the path using only the abilities of the human body. Park-our is considered an extreme sport. As its participants dash around a city, they may jump over fences, run up walls and even move from rooftop to rooftop.
Park-our can be just as exciting and charming as it sounds, but its participants see much more in park-our than that.
To overcome all the obstacles on the course and in life is part of the philosophy behind park-our. This is the same as life. You must determine your destination, go straight, jump over all the barriers as if in park-our and never fall back from them in your life to reach the destination successfully. A park-our lover said, ""I love park-our, because its philosophy has become my life, my way to do everything.""
Another philosophy we've learned from park-our is freedom. It can be done by anyone, at any time, anywhere in the world. It is a kind of expression of trust in yourself so that you earn energy and confidence.",high4150.txt
