,answers,options,questions,article,id
0,C,"['cars in the making', 'car rental firms', 'cars for rent', 'car makers']","The words ""deluxe sedans, "" ""minivans"" and ""station wagons"" used in the text refer to  _  .","Shanghai: Car rentals  are becoming more and more popular as an inexpensive way of taking to roads. Business people, foreign and families alike are making good use of the growing industry.
The first car rental firm opened in Shanghai in 1992 an dnow 12 car rental players are in the game, with more than 11,500 cars in their books.
The largest player-Shangha Bashi Tourism Car Rental Center offers a wide variety of choices-deluxe sedans, minivans, station wagons, coaches. Santana sedans are the big favorite.
Firms can attract enough customers for 70 percent of their cars every month. This fighure shoots up during holiday seasons like National Day, Labor Day and New Year's Day, with some recording 100 percent rental.
The major market force rests in the growing population of white-collar employees  , who can afford the new service, said Zhuang Yu, marketing manager of Shanghai Angel Car Rental Co.",high10833.txt
