,answers,options,questions,article,id
1,D,"['Kickoff Day.', ""Parents' Day."", ""Substitute Educators' Day."", 'Educator for a Day.']",What is related to the fourth day of the celebration?,"Today we celebrate our nation's school support staff and their tireless work in meeting the needs of all the students. See how Native American specialist Cecil Crawford is addressing a critical need by helping to lower the dropout rate at his school.
How Are You Celebrating American Education Week
Share your plans and photos with us at AEW@nea.org!
If you're on social media, be sure to use #AEW2015.
2015 Artwork: Click here for our 2015 poster, web banners, ads and more.
What Is American Education Week?
American Education Week -- November 16-20 -- presents all Americans with a wonderful opportunity to celebrate public education and honor individuals who are making a difference in ensuring that every child receives a quality education. This year's theme is ""Great Public Schools: A Basic Right and Our Responsibility"", and can be reflected in special observances each day of the weeklong celebration:
Monday, November 16: Kickoff Day
Tuesday, November 17: Parents' Day
Wednesday, November 18: Education Support Professionals' Day
Thursday, November 19: Educator for a Day
Friday, November 20: Substitute Educators' Day
Online Q&A: The Power of Teacher-parent Relationships for Student Success
Our Q&A has ended, but you can still visit our Facebook page and read through the great advice and discussion between parents and educators. Weigh in with your own ideas and keep the conversation going! Read more here.
Read more about the history of American Education Week.",high19714.txt
