,answers,options,questions,article,id
3,B,"['They are all written by kids.', 'Teens are likely to be the readers.', 'They are all best-sellers of this year.', 'Both kids and parents enjoy them.']",What do all the four books have in common?,"Extraordinary Teens
    The book will inspire young adults with its tales of teenagers achieving great success. It includes personal stories from many well-known young athletes, businessmen, actors, writers and filmmakers. Every person shares his or her story along with valuable advice that will show you how you can also achieve success. Learn from these people who are walking examples of possibility.
    Teens Talk High School
    This book is written for high school kids, aged 14-18. Teens in high school have mainly moved past worrying about puberty , so the stories in this book cover topics of interest to older teens, such as sports and clubs, driving, faming relationships, friends, and preparing for life after high school. High school students will find comfort and inspiration in the words of this book, referring to it through all the four years of their high school experience.
     Getting into College
     Every year colleges receive a lot of applications, and the application process has become something hard that students and parents experience together. This book isn't about how to get into college. It's about providing emotional support. The stories in this book are written by kids who have been there and want to pass on their words of support to others. Parents and students will find this book a great source of inspiration. 
     Campus Stories
     College life can be fun, exciting, and educational in more ways than one. Campus Storesis a book for any current  or future college student who wants to know what really goes on the campus. Campus Storesis about growing up, making choices, learning lessons, and making the best of your last as a student.",high20181.txt
