,answers,options,questions,article,id
2,B,"['China Daily: Newspaper', 'China Daily: New Employees Wanted', 'China Daily: An International Team', 'China Daily: The Best Working Condition']",Which can be the title of the advertisement?,"The China Daily newspaper group is hunting for English-language senior business editors, senior copy editors, copy editors and graphic designers to strengthen its international team. We offer a competitive salary package, free accommodation with utilities paid for, 90 per cent medical reimbursement, a seven-day paid leave, eleven day public holidays and a return ticket to the country of residence.
Senior Business Editor
You must:
Assist the Business editor in setting goals and working on achieving them;
Be an excellent team person who can generate ideas and think creatively and be able to rewrite totally if needed and mentor junior staff;
Ideally have been working or have worked in a position of responsibility and understand what leadership entails;
Have had at least five year's editing experience working on editing the Business Desk and be familiar with industry software.
Senior Copy Editor
You must:
Work on shifts in the Business Desk and usually have the last word before the page is sent to print;
Edit or rewrite copy and give snappy headlines and captions;
Have had at least two years' editing experience working on editing desks and be familiar with industry software.
CopyEditor
You must:
Be good at editing or rewriting copy and writing snappy headlines and captions;
Be able to work on shifts for different pages, and usually have the last word before the page is sent to print;
Have two years of editing experience working on copy desks, and be familiar with industry software.
Graphic Designer
You must:
Have excellent skills in information graphics;
Be good at illustrations and freehand drawings;
Be experienced in newspaper or magazine layouts;
Have a good sense of typography;
Have good news judgment;
Be wellversed with Macintosh software, including in Design, Illustrator and Photoshop;
Be fluent in English.
For enquiries or to apply, write tojob@chinadaily.com.cn.",high15786.txt
