,answers,options,questions,article,id
3,D,"['In a school magazine.', 'In a national paper.', 'In a guide book.', 'In a university daily newspaper.']",Where can you probably find this text?,"McGill Comedy Club
Important meetings today. Discussion on putting on Blazing Saddles. Union room 302, 3-4pm. New members (both actors and non-actors, living and dead) are welcome.
History Students' Association
Prof. Michael Cross of Dalhouseie University will be speaking on ""Unskilled Labor on Rivers and Canals in Upper Canada, 1820-1850: The beginning of Class Struggle"" at 10am. in Peacock 230.
Design Mirror Sale
All types and sizes of design mirrors priced to please. Sale today in Union room 108.
McGill Teaching Assistants' Association
A general meeting, for all the Tas will be held at 4pm. in peacock 116.
Women's Union
Important general meeting at 6pm. Union room 423. Speaker on ""Importance of Deciding Basic Goals of the Women's Union."" Everyone ----old, new and those interviewed, please attend.
Film Society
Last meeting of the term for all members. All managers are required to be present at 6pm. sharp, Union room 434.
Canadian University Students Overseas
CUSO presents ""Guess Who's Coming to Breakfast"" at 7pm. newman Centre, 3848 Peel. Find out about CUSO here and overseas. Everyone welcome.",high11498.txt
