,answers,options,questions,article,id
2,A,"['breakfast', 'snacks', 'swimming', 'washing']","At Magic Castle Hotel, you needn't pay extra money for   _  .","Hilton Universal City
Outdoor swimming pool; rooms with two double beds (sleep 4); mini-fridges in rooms; on-site restaurants and 24-hour room service with children's menu and snack cafe; fee car parking; the hotel is walking distance to Universal Studios and City Walk with lots of restaurants. 
Holiday Inn Universal Studios Hollywood
Rooms with two queen beds (sleep 4), a mini-fridge, a microwave and a game table; on-site restaurants serving breakfast, lunch and dinner with family-friendly food; outdoor swimming pool; fee car parking. 
Holiday Inn Express Universal City
Indoor swimming pool; rooms with two queen beds (sleep 4); breakfast is included in the room rate; free car parking; coin-operated laundry. 
Magic Castle Hotel
Breakfast is included in the room rate; snacks (such as cookies and ice cream); one or two bedroom suites (sleep 4); suites have fully-equipped kitchen, living and dining areas; restaurants in the neighborhood; fee car parking; outdoor swimming pool.",high21872.txt
