,answers,options,questions,article,id
1,D,"['not to play in the garden', 'to cook their lunch', 'not to go out', 'to be good']",Last Saturday their mother asked them   _  .,"Billy and Bobby were small boys. They were brothers, and they often fought each other.
Last Saturday their mother said to them, ""I'm going to cook our lunch now, go out and play in the garden......and be good.""
""Yes, Mum,"" the two boys answered, and they went out.
They played in the garden for half an hour, and then Billy ran in. ""Mum,"" he said, ""Bobby's broken a window in Mrs Allen's house."" Mrs Allen was one of their neighbours.
""He's a bad boy,"" his mother said. ""How did he break it?""
""I threw a stone at him,"" Billy answered, ""and he quickly moved down.""",high1244.txt
