,answers,options,questions,article,id
0,C,"['to analyze how fierce the competition is to get in a good college', 'to teach you how to court college admissions office', 'to report on a recent trend in college admissions in the US', 'to give information about different top American colleges']",The text is written mainly   _,"Call it proof of how carefully students court  college admissions offices these days :thank-you notes have become the new trend .
Tank the one that came with M &Ms  to match Lehigh University's school color1s of brown and white ,and with the applicant's name inscribed  on the candy .She thanked officials for her interview adding ,""Keep me on the tip of your tongue when reviewing applications .""
Leon Washington ,the dean of admissions and financial aid at Lehigh ,said that Lehigh received 50or 60 thank-you notes in just one day last week ,The notes are directed not just to admission officers ,but also to college tour guide and alumni who are often the ones conducting college interviews these days .
Parents also  _ the act ,such as the couple that thanked Mr. O'Cain of Furman for a ""most positive ""campus visit .Then they put in a plug  for their son ,saying that he had always been "" a high achiever and a hard worker ""and that they knew Furman would be just the place to ""help him reach his potential ""
At other campuses ,like Williams College and Princeton ,the motes go into applicants' files 
""Is it necessary to write a thank -you note ?""said Janet Rapelye ,dean of admissions at Princeton ""No ,in and of itself .it's not going to change a decision ,But I'm still in favor of them ,Expressing gratitude  is a lovely quality ""
Sometimes they are lovely .Carolyn Lawrence in California ,who advises students and their parents on college admissions ,recalls a note she received from a student admitted early to her first-choice college ,It came on a postcard of the Eiffel Tower ,It said :
""I spent my spring break -----
a)     on last -minute college visits 
b)     in a month-long anxiety attack waiting to her back from colleges 
c)     vacationing in Paris with my family and being forever grateful to Carolyn Lawrence for her help 
The answer is C. Thank you """,high20092.txt
