,answers,options,questions,article,id
1,B,"['the researchers from UCL did another study in Italy', 'a similar study was done on native Italian speakers who learn English as a second language', 'the research done on the Italians showed a totally different result', 'it will be easier for one to travel around the world by learning a second language']",We can learn from the passage that  _  .,"If you think English means endless new words, difficult grammar and sometimes strange pronunciation, you are wrong. Haven't you noticed that you have become smarter since you started to learn a language?
According to a new study by a British university, learning a second language can lead to an increase in your brain power. Researchers found that learning other languages changes _ . This is the area of the brain which processes information. It is similar to the way that exercise builds muscles.
The study also found the earlier people learn a second language, the greater the effect is.
A team led by Dr. Andrea Mechelli, from University College London(UCL), took a group of Britons who only spoke English. They were compared with a group of""early bilinguals "", who had learnt a second language before the age of five, as well as a number of later learners.
Scans showed that grey matter density in the brain was greater in bilinguals than in people without a second language. But the longer a person waited before mastering a new language, the smaller the difference was.
""Our findings suggest that the structure of the brain is changed by the experience of learning a second language,""said the scientists.
It means that the change itself increases the ability to learn.
Professor Dylan Vaughan Jones of the University of Wales, has researched the link between bilingualism and maths skills.
""Having two languages gives you two windows on the world and makes the brain more flexible,""he said,""You are actually going beyond language and have a better understanding of different ideas.""
The findings were matched in a study of native Italian speakers who had learned English as a second language between the ages of 2 and 34. Reading, writing and comprehension were all tested. The results showed that the earlier they started to learn, the better.""Studying a language means you get an entrance to another world,""explained the scientists.",high6570.txt
