,answers,options,questions,article,id
2,D,"['How to tip.', 'Body Language.', 'When to Have Dinner.', 'Advice to International Travellers.']",What's the best title of the passage?,"Different countries have different customs. When you travel to another country, please follow their customs, just as the saying goes, "" _ .""
Very often people who travel to the United States forget to tip  . It is usual to tip _ who help carry your bags, taxi drivers and waiters. Waiters expect to get a 15% tip on the cost of your meal. Taxi drivers expect about the same amount.
In England, make sure to stand in line even if there are only two of you. It's important to respect lines there. It's a good idea to talk about the weather. It's a favourite subject of conversation with the British.
In Spain, it's a good idea to have a light meal in the afternoon if someone invites you for dinner. People have dinner very late, and restaurants do not generally open until after 9 pm.
In Arab countries, men kiss one another on the cheek . Your host may welcome you with a kiss on both cheeks. It is polite for you to do the same.
In Japan, people usually give personal or business cards to each other when they meet for the first time. When a person gives you a card, don't put it into your pocket right away. The person expects you to read it.
Don't forget to be careful of your body language to express something in a conversation. A kind of body language that is used in one culture may be impolite in another.",high9995.txt
