,answers,options,questions,article,id
1,A,"['he had seen the man doing something strange', 'the man had fallen and needed attention', 'he thought he recognised the man', 'the man had tried to escape from the house']",The police officer questioned the man because  _  .,"Police Officer Tidwell left the station after 8 a.m. on Sunday. He was looking forward to his day of rest. By habit he took a short cut down the path behind prefix = st1 /Digby Hall Road. Suddenly he saw a man climbing down a drain-pipe from an open bedroom window of number 29. Quietly Tidwell walked into the garden. The man had just reached the ground when he felt his arm grasped.
""It seems an unlikely adventure. Would you mind explaining? "" said the officer. The man was frightened, saying, ""I know what's on your mind, officer, but it is a mistake. "" 
""It's part of my job to take an interest in unusual events. I think you've just left this house in a manner other than the customary one. "" Tidwell took out his notebook and a pen. ""Name, address and your job and then, please, tell me your story."" 
""Charlie Crane, Lorry Driver, from Nottingham, 51 Brecon Street. My story...""
""Yes, What were you doing, Mr. Crane?"" 
""Well, I had a breakdown yesterday and had to stay here until it was fixed. Bed and breakfast. The landlady is Mrs. Fern. She gave me breakfast at seven, and I was out here in the right way and down at the lorry park. It was only when I felt for a cigarette that I realised I'd left 80 pounds under the pillow. It's my habit to put my money under the pillow at night."" 
""I see. Have you paid Mrs. Fern?"" 
""I'd paid her last night. So I came back, but it's Sunday, and she'd gone back to bed. Could I wake her? I rang the bell and knocked on the door for ten minutes before I came here and found my bedroom window still open. Up I went, then, up this pipe. The money was still there. I hope you believe it because..."" 
""Mr. Crane, what are you doing here? I thought you'd gone an hour ago."" It was Mrs. Fern, speaking from the kitchen window.",high22270.txt
