,answers,options,questions,article,id
2,D,"['seeing a doctor', 'going to church', 'eating food', 'go to school']","According to the text, people can do all the things in some malls EXCEPT   _  .","Malls are popular places for Americans to go to. Some people spend so much time at malls that they are called mall rats. Mall rats shop until they visit hundreds of stores.
People like malls for many reasons. They feel safe because malls have police stations. Parking is usually free. And the weather inside is always fine. The newest malls have beautiful rest places with waterfalls and large green trees.
The Mall of America in Minnesota is one of the most popular ones. It covers 4.2 million square feet. It has 350 stores, eight nightclubs, and a large park! There are parking spaces for 12,750 cars. About 750,000 people shop there every week.
The first indoor mall in the United States was built in 1965 in Edina Minnesota. People love doing all their shopping in one place. More malls are built around the country. Now malls are town centers where people come to do many things. They shop, and of course, they also eat in food courts that have food from all over the world. They see films at theaters. Some people even get their exercise by doing the new sport of ""mall walking"". Others go to malls to meet friends.
In some malls, people can see a doctor and even go to church. In other words, people can do almost everything in malls. Now people can live in their favorite shopping centers in fact.",high14166.txt
