,answers,options,questions,article,id
0,B,"['An actor.', 'A novelist', 'A movie director.', 'A translator.']",Who is Harper Lee?,"In films, dads change from cruel men to loving souls. Here is a list of good and bad movies dads .Atticus Finch in To kill a Mockingbird 
GOOD DAD:A man whose wife has died with a young family and a busy job as a lawyer, Gregory Peck's character in the  1962 film is one of the great heroes of American cinema  Firm but fair he teaches his children respect and human decency .Harper Lee's novel gets a respectable transposition to film, thanks to Gregory Peck's perfect performance.
Jack Torrance in The Shining
BAD DAD: When Jack Torrance ,his wife ,Wendy ,and son, Danny ,escaped from the cold winter to  the Overlook Hotel  we know that Jack has hardly been a model father But when Jack becomes extremely angry and tries to murder his family with an axe, Danny used his intelligence to defeat him and left him to  freeze to death.
George Bailey in It's a Wonderful life
GOOD DAD: James Stewart's character is a father-of-four who is saved from the edge of suicide  and realizes his positive effect on others lives.Much of the film is unpleasant, with George shouting at his children as he faces financial problems.  But finally the lovable father realizes the worth of his own life, the value of friendship and the importance of being a loving dad
Darth Vader in The Empire Strikes Back 
BAD DAD: When the unfriendly cyborg told Luke Skywalker that he was his father ,the son's reaction says it all: ""No! No!"" It's hardly a joyful welcome to the family.  For most of his son's life, Darth Vader has been an absent dad--and he has just cut off Luke's hand You can understand why Father's Day cards might not be available.",high5617.txt
