,answers,options,questions,article,id
1,D,"['the name of a car-rental company', 'the place for the holiday', 'the name of an ordinary car', 'the name of an expensive car']",According to the passage we can see SUV is  _  .,"Shanghai ---- More Shanghai people are renting cars to travel over the coming National Day holiday, Tom reported today.
Most cars in large local car-rental companies such as Yongda,Anji and Dazhong are rented so far with the Buick Sport Utility Vehicle(SUV)in great need.
Santana and Jetta were the most popular car models rented by Shanghai people for travel last year,while the high-end Buick models have attracted more people this year. However,the rent on a Buick GL or GS model is between 650 yuanand 750yuana day,nearly double that of Santana or Jetta cars.
Compared with Santana,Buick looks better,which has greater capabilities  and is safer and more comfortable,said a car renter."" I don't mind paying a higher cost for a Buick to enjoy the holiday,""he said.
SUV cars are very popular in the car renting market, according to some car-rental firms.
""All the 31 Buick GL&SUV cars were rented out several days ago,"" said a manager in the Shanghai Yongda Car Rental Co.
Local people would like to go travel with as groups of friends,so SUV cars are a better choice,said an industry analyst. Moreover, SUV cars are safer on rough roads,the analyst said.
According to the data,most people rented cars for seven days,a lesser number rented them for two or three days.",high21036.txt
