,answers,options,questions,article,id
0,B,"['singer', 'painter', 'play', 'painting']",From the text we know that the word Rembrand is most likely the name of a famous   _      .,"If you are looking for the place that has everything, there ' s only one place to visit, and that's New York. It's a whole world in a city.
The World Of Theatre: All of New York is. And it begins with Broadway. Where else can you find so many hit shows in one place? Only in New York!
The World Of Music: Spend an evening with Beethoven at Lincoln Center. Swing to the great
Jazz of Greenwich Village. Or rock yourself silly at the hottest dance spots found anywhere.
The World Of Art: From  _ to Picasso. From Egyptian tombs to Indian Teepees. Whatever kind of art you like, you'11 find it in New York.
The World Of Fine Dining : Whether it' s roast Beijing duck in China-town, lasagna in little Italy, or the finest French coq au vin found anywhere, there's a world of great taste waiting for you in New York.
The World Of Sights: What other city has a statue of Liberty  ? A Rocketfeiler center? Or a Bronx zoo? Where else can you take a horse drawing carriage through Central Park, only in New York!",high23323.txt
