,answers,options,questions,article,id
1,B,"['It is merely beneficial to employees', 'It is a win-win event for employees and employers.', 'Valuing education has become a trend for all companies.', 'It turns out to be tough for firms to find suitable employees.']",What can we learn from what Colleen Flaherty said?,"As the labor market becomes more attractive, more companies are sending their employees to school. Fiat Chrysler Automobiles is the latest company to use tuition assistance for employees - which for decades has been a part of many business' benefits packages - as part of a renewed effort to bring in and cultivate talent. And while the impact of such programs has yet to be fully assessed, many see it as a positive - although gradual - movement.
""For workers, it gives them a better opportunity for development,"" says Colleen Flaherty Manchester, a professor. ""For firms, they are able to recruit the type of employees who have value education and are less likely to turn over, and thus have a higher level of retention  .""
In all, 56 percent of US organizations offer undergraduate educational assistance while 52 percent offer graduate assistance.
Largely driving the trend are Millennials, who happen to be the fastest-growing people in the US workforce today and to whom the idea of tuition support from employers is especially appealing. Nearly 60 percent of Millennials surveyed said they would choose a job with strong professional-development potential over one with regular pay raises. Employers are absolutely adapting to Millennials in the workplace. They recognize that they need more experience, more knowledge, more mentoring to be successful. And they're asking for _ .
Of more than 140,000 Starbucks employees, only about 4,000 have signed up for the company's College Achievement Plan. What the long-term effects such programs might have for companies' retention and turnover rates remain unclear. But, the pluses of these programs are more important than the minuses. We're going to see a lot more of this in the future.",high13667.txt
