,answers,options,questions,article,id
1,A,"[""in a school's bulletin board"", ""in a school's text book"", 'in a latest newspaper', 'in a fashion magazine']",The passage may probably be found   _  .,"Social Program: 22nd--26th August 2011
Monday Evening--Study Centre or Sports Park
Study Center: The school will be open from 7.45 pm to 9.35pm.
Sports Park: Aerobics, Swimming or Fitness Training (with a Fitness Card).
Tuesday Evening--Cinema
Cinema: To get your free ticket, you must write down which film you would like to watch. See the leaflet on the board for this evening's UCI Cinema program. For more information about the films, visit the UCI website www.uci.co.uk or see the film section in this week's Time Out magazine.
Wednesday Evening--Study Centre of Tennis Coaching
Study Center: The school will be open from 7.35 pm to 9.35 pm.
Tennis Coaching: With former Junior Wimbledon tennis player Stuart Silvester.
Thursday Evening--Chinese Party
Chinese Party: Come along and enjoy the hospitality of the Chinese students! You can try delicious Chinese food and learn about Chinese traditions. Please note that you should eat your evening meal at your home-stay, as the food is a taster and not a full meal. Non alcoholic and alcoholic drinks will be served.
Friday afternoon--Historical Walking Tour or Sports Parks
Historical Walking Tour: This afternoon you will have the opportunity to visit parts of Norwich you may have otherwise missed, with a professional guide. In medieval times Norwich was the second most important city in England and this afternoon you can learn some of the interesting history of our fine city.
Sports Park: Badminton, Basketball, Fitness Training (with a Fitness Card), Football, Squash, Swimming or Volleyball.
Please sign early if you wish to play any of the sports listed above.",high3086.txt
