,answers,options,questions,article,id
2,C,"['To attract teens or kids to EF', ""To stress EF's achievements in China."", 'To employ teachers working in China.', 'To introduce the company English First.']",What is the purpose of the passage?,"EF (English First) is the world's leading privately owned education company. Founded in 1965, EF operates in over 50 countries around the world. We have vacancies for teaching positions across China so if you prefer the fast-paced city life like Shanghai, we probably have the position for you. We have both Kids&Teens schools and Adult schools in over 60 cities in China.
Teaching at English First
At English First, you'll be provided the resources to become the best teacher you can be. Our new and color1ful classrooms offer state-of-the-art  technology including Internet-connected computers, interactive whiteboards and iPads. We also offer a world-class teacher development program with certification courses to our teachers to help them move into more senior positions within EF.
Join the EF Teacher Network today
Join a supportive community of EF staff and teachers from day one. We're here to provide the support you need every step of the way, from preparing your legal work visa to airport pickup. Learn how to order food in Chinese with our free language classes or attend a weekly teacher social sponsored by the company. There's so much to experience living abroad and you'll experience it to the fullest with EF.
Requirements
A bachelor's degree
A TEFL Certificate (EF TEFL sponsorship available)
Passport holders from the UK, the USA, Canada, Ireland, Australia, South Africa or New Zealand
The ability to obtain a clear background check
The ability to live abroad for at least one year
Your benefits package
12,000-13,500 RMB monthly, based on qualifications
10 paid annual leave days plus 11 national holidays
Airport pickup upon arrival
Free hotel accommodation during your first two weeks at EF
Free Mandarin Chinese lessons",high19591.txt
