,answers,options,questions,article,id
0,D,"['Status.', 'Freedom.', 'Individuality.', 'Opportunity.']","Which of the following doesn't a car represent,according to the passage?","China's economy grows,salaries rise;and more city residents feel the need to hit the road in what has become a symbol of individuality and freedom--a car.China has a growing love affair with the car.This is clear at the Beijing Asian Games Village Automobile Exchange,where more and more people come to look and,increasingly,to buy.
The Asian Games Village Automobile Exchange is the biggest car dealership inBeijing.General manager Guo Yong says the business sells more than 2,000 cars each week.Guo says it is much easier for Chinese consumers to buy a car now.Also,the emergence of less expensive domestic brands like Chery and BYD means more Chinese can afford cars.
For decades,most Chinese city residents have got about by bicycle or public buses and trains.Now,in many areas,the number of new cars is growing faster than the road system,leaving city streets jammed with traffic.
Guo Liang has wanted to buy a car for a decade,and he will be the first in his family to own one.He is not prevented by Beijing's traffic jams.Guo says if the traffic is too bad,he will use the ear for leisure or holidays with his family.
World Bank transportation specialist Shomik Mendhiratta says a car is something people in any society would be eager to own.""Getting a car makes people feel like they have arrived in the middle class.""Mendhiratta said.""It has got a huge status associated with it.It's a fantastic thing to have,if you have never had a car.A car gives you a mobility that's unbelievable.""",high19159.txt
