,answers,options,questions,article,id
3,C,"['develop at the same speed as now', 'fall behind others', 'be developed rapidly', 'continue cooperation with foreigners']",From the passage we can infer thatChina's service industry will   _   in future.,"Foreigners are likely to acquire   more investment opportunities in China since the central government has passed a fresh regulation on Tuesday to attract foreign capital  . 
The regulation, which will take effect on April 1, outlines how prefix = st1 /Chinawill expand cooperation with foreign investors. Compared with the old foreign investment guideline, the government has given foreigners more investment opportunities. And the government also encourages foreigners to take part in the key state owned enterprises reform . 
According to the regulation, overseas investors are expected to become shareholders in the key state owned enterprises.  Overseas investors will even be allowed to hold the controlling stake in the large state owned enterprises, except for those of key importance to national or economic security. 
""China's WTO membership has reduced the risks and costs for foreign investors, and more capital and advanced techniques and expert knowledge or skill are expected to flow in,"" an official said.
In particular, the new regulation appeals ( makes an earnest request ) for capital for agricultural technology, transportation, energy and new material industry.  The service industry, including banking, telecommunication, insurance, and tourism, will gradually become another focal point of cooperation.
The country hopes foreign investors start businesses in the western regions, where they will enjoy more favorable taxation policies for the next 10 years.",high19067.txt
