,answers,options,questions,article,id
1,B,"['the less money that will be charged for the tickets to the auction', 'the more money that can be raised to support the computer lab', 'the faster the ticket will be sold to the auction', 'the higher the value that will be placed on the items in the silent auction']","The more items that are given or bought for auction,   _  .","Here is a poster on a middle school web site. Read the web-site poster.
Going, Going, Gone!
The Haynes Middle School Parent-Teacher organization
Invites you to attend our latest fund-raiser,
The Fourth Annual Haynes School Auction !
Saturday, May 10
6:00 p.m.-11: p.m.
in the school hall
6:00 p.m.-6:30 p.m. :All items for auction are previewed.
6:30 p.m.-7:00 p.m. : Silent auction begins.
7:00 p.m.-7:30 p.m. : Highest bidders from silent auction are determined.
7:30 p.m.-11:00 p.m. : Main auction begins.
Items up for bid in the silent auction range in value from $ 5.00 to $ 30.00.
Items up for bid in the main auction include the following:
l         Airline tickets to a place of your choice
l         Weekend getaways at first-class hotels
l         Season tickets to the Chicago Bears football game
l         $ 50 gift tickets to local gift shops, restaurants, and salons
Don't miss the boat! Book your tickets today.
Last year, tickets sold out in five days!
Tickets are sold on a first-come, first-served basis.
$ 15.00 per person
All the money from the auction will be given to the prefix = st1 /HaynesSchoolcomputer lab.",high17210.txt
