,answers,options,questions,article,id
0,D,"['Experts hold the view that Russian people think little of Tolstoy', ""Western people believe Tolstoy provides good solutions to today's issue"", 'It is tough for us to remain positive in hard economic time', ""Tolstoy's worldview didn't suit the Russian s in the last century""]",We can infer from the article that   _,"This year marks the 100thanniversary of Leo Tolstoy's death. He is considered by many to be one of the greatest novelists of all time. Much of the West is marking the anniversary with new translations of the author's works, including War and Peace. Movies are being released, including a black-and-white documentary and a feature film. In short, everyone is celebrating. Everyone, that is, except for people in Tolstoy's home country, Russia.
  The English newspaper the Guardian reports that the Russian government has scheduled nothing for November, the official anniversary of Tolstoy's death. The quiet is amazing, considering the importance of this man's contribution to global culture.
  ""Across the whole world there is a huge Tolstoy boom ,"" Andrei Deryabin, co-producer of a new film about the author's final days titled The Last Station, told the Guardian. ""He's esteemed  everywhere apart from here in Russia.""
   Experts explain the government's silence in various ways. Some refer to Tolstoy's disagreement with state-backed religion. Tolstoy's Christian views often  _ those of the Roman Catholic church.
  His great grandson, Vladimir Ilyich Tolstoy, thinks Russia's cool attitude has more to do with history and the author's positive worldview. After all, the last century was a difficult one of the country's people. The darker writings of Fyodor Dostoevsky, he says, better fit the national character. Tolstoy hopes that as Russians grow more optimistic they will rediscover one of their own national treasures.
  ""Tolstoy gives positive answers to the questions mankind is asking,"" he told the Guardian. "" In this sense he gives more hope. I hope the 21stcentury is Tolstoyan.""",high20806.txt
