,answers,options,questions,article,id
3,D,"['Bay Village Branch and Fairview Park Branch', 'North Olmsted Branch and Olmsted Falls Library', 'Fairview Park Branch and Olmsted Falls Library', 'Fairview Park Branch and North Olmsted Branch']","In order to help yourself find a new job soon, you'd better go to  _  .","Bay Village Branch, 502 Cahoon Road, 440-871-6392.
The Egyptian Pyramids, 7 p. m. Sept. 17. Join us as Don King, a long-time student of Egyptology,
discusses the pyramids and presents the possible theories of the construction, design and mysteries surrounding
these ancient wonders.
Join us as local Bay Village resident, Tom Bell, discusses his book ""My Dad Is a Freak: a Memoir"", 7
p.m.Sept. 27.
Fairview Park Branch, 21255 Lorain Road, 440-333-4700 or cuyahogalibrary. org.
Dress for Success, 7 p. m. Sept. 17. First impressions count. Some job recruiters  use
appearance to determine self-esteem, respect, confidence and organizational skills. Learn how to dress to
emphasize your strengths and improve your employ ability. Registration required.
Music Study Groups, 1:15--2:45 p. m. Wednesdays, Sept. 19--Nov. 28. Explore current concert music
performed by The Cleveland Orchestra at Severance Hall through informal lectures and listening. Classes are
designed for both new and experienced music lovers and are led by Dr. Rose Breckenridge.
Practical Herbs, 7 p. m. Oct. 3. Famous doctor Sarah Hurt will talk about growing, drying and storing
herbs and how to use them. Registration required.
North Olmsted Branch, 27403 Lorain Road. 440-777-6211 or cuyahogalibrary. org.
Job Club, 1:30--3 p. m. Tuesdays. Join Jim Hansen for helpful tips on resumes, job search strategies and
interviewing. Anyone who is job hunting or looking to change careers is welcome.
War of 1812, 7--8:45 p. m. Sept. 17. This year marks the 200thanniversary. Professor Catherine Rokicky
From Cuyahoga Community College will give a presentation about the war, and immediately following we'll
discuss the book ""Mr. and Mrs. Madison's War: America's First Couple and the Second War of Independence""
by Hugh Howard. Registration required.
Olmsted Falls Library, 7850 Main St. , Olmsted Falls. 440-235-1150 or cuyahogalibrary. org.
Family Story-time, 7--7:30 p. m. Wednesdays, through Nov. 27. Join us for rhymes, songs, finger-plays
and a story or two. For children ages birth through age 8 with their caregivers.
Huntington Practice SAT Test, 10 a. m. to 1 p. m. Sept. 15. Follow up, 4--5 p. m. Sept. 26. Get ready for
college by taking a practice SAT exam. Discuss strategies to improve your score, and get tips on preparing for
the real exam. Registration required.
Imaginative Illustrations, 11 a. m. to noon Sept. 29. A hands-on drawing program where children exercise
their imagination while experiencing some basic techniques of cartooning. Grades K-5. Registration required.",high5173.txt
