,answers,options,questions,article,id
3,D,"['To warn us not to eat fast food.', ""To introduce Frank Partnoy's opinion."", 'To encourage us to work more efficiently.', 'To show the importance of a proper lunch.']",What might be the author's purpose in writing the text?,"In today's fast-paced   society, few people take time to enjoy the midday meal.Most of us just rush right through it. We grab a quick salad, or buy a sandwich and eat at our computers, Sometimes, if there is a deadline around the corner, we just _ 
The development of technology hasn't done our eating habits much good either.We are constantly distracted by e-mail, social media, and 24 - hour news.Even when we do sit down for lunch, we are more connected to our hand - held electronic devices.
Long working hours can cause all kinds of health problems, and many developed countries have put in place labor laws specifically regarding the lunch break.These laws give employees the right to take a break during a long work shift, but it's up to them whether they do so or not.
Frank Partnoy, a former Wall Street trader, says that employers should encourage workers to take time off for lunch.This is because long lunch breaks can benefit both individuals and society.
Writing in The Guardian, Partnoy says that one obvious reason to take a lunch break is to slow down and gain some perspective . A break from work allows us to think strategically and outside the box.It also puts our daily tasks into a broader context .
What we eat at lunch is also important.In Partnoy' s opinion, a fast food lunch is more harmful than not having lunch at all.  And it's not just about calories and unhealthy food.Recent studies show that fast food also has negative effects on how we think.
However, if we sit down at a proper restaurant and chat leisurely with colleagues, we are more likely to slow down, something that hardly can be achieved in a noisy and over -- packed fast food chain.
Despite these benefits, some employees might still be unwilling to take time off for lunch.Partnoy's suggestion? Make skipping lunch difficult: Employers could ask workers to fill out a form stating their reasons for skipping the meal.",high4611.txt
