,answers,options,questions,article,id
2,A,"['work out its technical problems besides using the Internet', 'use the Internet besides working out its technical problems', 'sort through all kinds of information on www', 'help your friends with your Net knowledge']","According to the writer,it's better to  _  .","You've probably heard of a lot about the Internet,but what is it?
The Internet is a computer network that uses the telephone system to connect together millions of computers around the world. Maybe that isn't very exciting but once you're connected to the Internet,there are lots of different things you can do.You can send electronic messages or emails to your friends (as long as they're on the Internet,too),or you can sort through all kinds of information on something called the World Wide Web.
You don't need to know how the Internet works in order to use it,but if you understand the basics,it may help you work out many technical problems you have--and of course you can help your friends with your Net knowledge!
You may think that your telephone is just for talking. But as long as you have the equipment, you can use a telephone line to send computer data as well as sounds. If you connect your computer with the telephone system it can receive information from, and send information to other computers (as long as they are connected with the telephone system,too).
Because there is not an organization which operates the Internet,no one exactly knows how many people are connected to it. It's thought that there could be 60 million people on the Net,connected up to over 15 million computers!",high8938.txt
