,answers,options,questions,article,id
2,C,"['Chris was not a good designer', 'Chris and Ashley were friendly to each other', 'Chris herself must have written the letter', ""It may sometimes bring about bad luck to speak out one's mind""]",We may infer from this passage that   _  .,"Ashley and Chris work in the same department designing postcards. Chris had a college degree in art and deeply felt that the degree of his designs was excellent. His last postcard showed the depth of a desert's beauty and delights.
""It's just a picture of the desert,"" Ashley said. ""Not deep at all.""
""Some people desire seeing beauty,"" Chris replied. ""Mine delivers that"".
Ashley laughed and said, ""well, that depends on what you think beauty is.""
Days later, someone delivered a letter to Ashley. The letter said, ""You are worthy of the bad things that will come your way. You will know the taste of defeat, and I will destroy you.""
Ashley suddenly felt very cold. It was as if the room temperature had dropped 30 degrees. ""Who would do such a shocking deed?"" she wondered. ""I will not let a simple letter defeat me.""
Just then, Chris came into the room and offered Ashley a piece of his sandwich.
""Try some,"" he smiled widely. ""It's delicious.""
""Are you trying to poison me?"" Ashley asked. Chris's answer was delayed from confusion. ""What's your problem?"" he asked.
The next day, Ashley brought a bat to use to defend herself. When Chris saw her bat, he joked, ""Defend and win one for the team.""
Ashley took no notice of him. She spent the whole day reading self-defending books and placed her work on delay. ""You can't delay your work. Our job demands us to do our work on time,"" Chris said. ""We must meet the demands of our job.""
""You're not the boss,"" Ashley replied. ""Don't make demands of me.""
Because Ashley failed to do her work, she was fired.
Chris glanced at Ashley's empty desk and smiled.",high4466.txt
