,answers,options,questions,article,id
0,D,"['they are too common', 'they look very beautiful', 'there are more restaurants', 'they are in great need']",Many people are beginning to plant mushrooms probably because   _  .,"Growing mushrooms  is probably the easiest thing you can do if you are new to mushroom growing. Mushroom growing is becoming more and more common as restaurants are creating more dishes that include mushrooms.
Mushroom growing is easy. To start with you need to have a growing space where you are going to grow these mushrooms. It does not have to be too big enough for you to grow as many mushrooms as you need. When you have found the space that is perfect for you, you can start to research what kind of mushrooms you want to grow. There are hundreds of kinds to choose from but not all mushrooms are _ which is an important fact you need to remember before you start. Don't grow mushrooms you can't use or sell.
When you figure out what kind of mushrooms you want to grow, you can make some preparations. Sometimes you need to hire some workers to help you if you have a large mushroom farm, or if you are trying to start a professional mushroom growing business. Trying to start a business by yourself can be stressful. If you don't have time to take care of everything yourself, to hire a worker is the best bet.
After you have started the mushroom growing, you should regularly check and make sure that your mushrooms are growing properly and that they are not being attacked by any pesticides  or any other animals that are potentially dangerous for them. That is the worst situation of mushroom growing. Protect your mushroom farm well with a fence or a gate so that only you and your workers can get in an out.
Mushroom growing is not difficult and is a really easy way to get started in the field of farming. You will possibly supply some of the great chefs  of the world with high-quality mushrooms that will be enjoyed by thousands of people around the world.",high12284.txt
