,answers,options,questions,article,id
2,A,"['are in different areas', 'are in the same developing area', 'are of the same price', 'belong to the same developing company']",From the advertisements we can know the apartments   _  .,"The apartments for sales,40 minutes' walk to the gold coast beach, on the ground floor is a private patio , fully fitted kitchen, resting room with feature fireplace and a second reception room which could be used as a dinning room or third downstairs bedroom. On the first floor are two double bedrooms, one of which leads onto a sunny terrace , fully tiled bathroom with bath and shower. The property is in excellent condition throughout and is ready to move straight into Sky TV, telephone and broadband are connected.
Status: Available                                 Price: EURC/115,000
Telephone: 00351-981888988         Location: Mollina Malaga Province Spain
Apartment furnished for sale at an unbelievable price. The apartment is part of a small complex with swimming pool and a public resting-room with TV, relaxing area, changing areas, etc. The apartment is on the market fully furnished, air conditioning, with good environment to all divisions of the apartment. If you are thinking _ the rental market while the property is empty during the year, this property could be your best bet at the best possible price.
Number of Bedrooms: 2
Status: Available                                 Price: EURC/147,000
Telephone: 00331-961777017                     Location: Sao Leiria Portugal
Nice villa for sale. The villa has 4 bedrooms and 4 bathrooms. Beach at walking distance. Outside there is a swimming pool. The villa is just outside inland coast in a small villa of 20 houses.
Status: Available                               Price: EURC/340,000
Telephone: 04811-961999018                     Location: Inland Costal Area",high11885.txt
