,answers,options,questions,article,id
4,D,"['The 2014 World Cup will open at the Arena de Sao Paulo on 12 June.', 'Pitbull has had 11 top 10 tracks in the Official Singles Chart so far.', 'The power of music and football will help unify US,when we are one.', 'We Are One has been chosen as the theme song of the 2014W0rldCup.']",What does the whole text mainly tell us?,"Fifa has announced a track by Pitbull and Jennifer Lopez as the official the me
song for the 2014 World Cup in Brazil.
    We are one,which also features Brazilian singer Claudia Leitte,will be performed at the
opening ceremony at the Arena de Sao Paulo on 12 June.
    The track will be released later this year in the lead up to the World Cup.It will also be included on the upcoming official 2014 Fifa WorldCup album.
    Pitbull said,""I truly believe that this great game and the power of music will help unify us,because we are best when we are one.""The 33-year-old singer, also known as Mr.Worldwide,has had 11 top 10 tracks in the Official Singles Chart to date.His most recent single,""Timber which features Kesha,was the first number one of 2014.    
  ""I grew up in a house that loved football.so I am thrilled to be performing at the World  Cup Opening Ceremonies, with  Pitbull and Claudia Leitte,""said Jennifer Lopez.""This is all 
amazing celebration of global unity,competition and the sport.""
  The last Fifa World Cup song for the South Africa tournament in 2010 was Waka Waka by  Shakira.The track peaked at number 21 in the Official Singles Chart and the video has been 
viewed almost 600 million times on YouTube.
    Talking about this year's track,Fifa General Secretary Jerome Valcke added,""In my many
visits to this country I've seen and heard a lot about the great Brazilian music tradition and it
gives me great pleasure to see a Brazilian artist at the heart of this song.I'm sure,like me,
millions of football and music fans all over the world will be eagerly awaiting the song's  release.""",high17414.txt
