,answers,options,questions,article,id
0,C,"[""By presenting others' prediction"", 'By asking a question', 'By providing opposite opinions', 'By talking about the background']",How does the author present the topic to be discussed?,"Some say the Internet will kill off papers. Others say not so fast.
Are newspapers dying?
That's the heated debate these days. Many say the disappearance of the daily paper is just a matter of time. The future of journalism is in news websites, not newsprint.
However, others say, newspapers have been with us for hundreds of years, and while all news may be online some day, papers can exist for some time.
So who's right? I'll outline the arguments on both sides, and then you can decide.
Newspapers Are Dead
Newspapers are in trouble. Circulation is dropping, display and classified ad income is drying up, and the industry has experienced a hard time. Big metro papers like the Rocky Mountain News have stopped operating, and even bigger newspaper companies like the Tribune Co. go bankrupt .
And where are newspaper readers going? To the Web. A recent study has found that Internet users read online newspapers for an average of 53 minutes per week in 2008. That's highest level recorded in the eight years when the study has been done.
The study found that 22 percent of users said they stopped their subscription to a printed paper or magazine because they could access the same content online.
Some people say the Internet is just a better place to get the news. ""On the Web, newspapers are live, and they can supplement their coverage with audio, video, and the valuable resources of their vast contents,"" says Geffrey I. Cole, director of the Center for the Digital Future.",high5417.txt
