,answers,options,questions,article,id
1,A,"['English and Home Economics', 'English and Geography', 'Maths and Geography', 'History and Geography']",Alan does well in   _  .            .,"Report Card   London Woodland School
Name: Alan     Class: 5        Grade: 8
Grade teacher:   Mr Jim Green
English:        Good work this term. He has a good memory and is good at speaking.  A
Maths:         Good. But sometimes he is careless.                              B
History:        He knows a lot about British history, but little about other countries.    B
Geography:     He is a clever student but sometimes doesn't do his best.            C
Home Economics:  Good. He likes it best. He can do things for himself.              A",middle2416.txt
