,answers,options,questions,article,id
1,A,"['her husband', 'her children', 'her sister', 'the doctor']",The next morning Mrs Brown makes a cake for  _  .,"Mrs Brown is very fat  .
""Don't eat meat or cakes,""her doctor says to her.
""I'm going to stop her eating them, doctor,""her husband   says.
The next morning, Mrs Brown makes a nice cake, and her husband eats half of it. After he goes out, Mrs Brown cuts   a very small piece of the cake and eats it. It is very good. She cuts a bigger piece and eats it. In a few minutes she finishes the cake.""My husband is going to be very angry  ,""she says.""What am I going to do?""
She makes another cake very quickly, eats half of that, and leaves half on the table.
Her husband comes back later. He sees the half of the cake on the table and he is very happy.",middle7666.txt
