,answers,options,questions,article,id
2,A,"['Japanese history', 'Japanese cartoons', 'American films', 'American music']",The French kids like all of the following except   _   .,"Many French teachers and parents complain that their kids are less bright than they were. They say young people visit museums less often and spend too much time on the Internet. They only read comics  and listen to music, and like American culture more than their own. But is this true?  A recent survey shows that many French kids spend their time as other kids always have.
Most French teens love music, with 86% putting it as their top hobby, above the cinema, sport and television.
French kids read a lot and like different things, from Japanese cartoons to American novels.
Many French people worry that their children watch too many American films and listen to too much American music.
But the results of this survey show that French young people like their own culture.
As Silvia Berlin, a student from Paris, says, "" _ """,middle7628.txt
