,answers,options,questions,article,id
3,C,"['67582', '873-3516', 'ZA9Z78', '894-2015']",Jim's car number is   _  .,"Jane  09:45:10
Hi, Jim. Nice to meet you!
I'm a girl. My name is Jane Green. My favorite   color is red. I have a red bike. My bike number is 67582. My telephone number is 873-3516.
Jim 09:46:05
Hi, Jane . Nice to meet you, too!
I'm a boy. My name's Jim Hand. My favorite color is blue. I have a blue car.  My car number is ZA9Z78. And my telephone number is 894-2015.",middle4166.txt
