,answers,options,questions,article,id
2,A,"['to study English every day .', 'to ask your classmates for help.', 'to write to your friends in English .', 'to ask your teachers for help.']",The most important thing to study English is   _,"I'm Molly Taylor. I am a student of No.8 middle School . I don't like English classes when I begin to learn English. Because I think English is difficult. But now I do well in English. I think if we know how to study English , we will find it very interesting and easy. Here are some ways to help you .
Don't be afraid of speaking English.
Listen to English speakers often .
Watch lots of English movies.
Listen to English radio shows .
Do many English exercises .
Write to your friends in English.
There are so many ways to study English and we can use our favorite ones. But I think the most important thing is to study English every day . When we meet some difficulties , we can ask our teachers or classmates for help.",middle4997.txt
