,answers,options,questions,article,id
4,D,"['Mrs. Black is going to take Peter to see a doctor.', 'Peter likes to watch TV at four in the afternoon.', 'Peter is a stupid boy.', ""Peter isn't an honest boy.""]",Which sentence is right?,"Peter is thirteen years old. He is in Grade Two this year. He likes playing football and watching football matches. And he often reads newspaper. He does his best to know where and when there is going to be a football match. Now Peter is having lunch. He is listening to the radio, too. He is very happy because there is going to be a nice football match on TV at four this afternoon.
He wants to watch it very much. But he is going to have English and Chinese lessons. He thinks hard and finds a way.
""Hello, Mrs. Black,"" Peter says to his teacher on the telephone. "" Peter is ill in bed. He wants to ask for half a day's leave   .""
""Oh, I'm sorry to hear that,"" says Mrs. Black, ""But who's that? ""
""It's my father, Mr. Black.""",middle4750.txt
