,answers,options,questions,article,id
2,B,"['The website baidu.com', 'The website sina.com', 'The website Yahoo.com', 'The website blog.com']",_   invited Xu Jinglei who was one of the first famous people to open blogs.,"A survey by baidu.com showed there were 16 million bloggers  . Xu Jinglei was one of the first famous people that the website sina .com. invited to open blogs.
The web log written by Xu Jinglei is now the world's most popular . Xu , an actress-turned -director, became famous overseas when she won a Best Director Award for the film. A  Letter From an Unknown Woman in 2004.
Her blog has broken the domestic   record  with more than 10 million visits .
Xu updates   her blog every other day . But if she feels very good she sometimes posts two or three articles in a day .
Visitors leave thousands of messages about each of her articles , praising   her open, free writing style, commenting   on films.",middle2197.txt
