,answers,options,questions,article,id
3,B,"['Monday', 'Friday', 'Wednesday', 'Thursday']","According to the news, the talent show will be on  _  .","School news (June 8th, Friday)
School trip: Students in Junior Two had a great time during the school trip on Children's Day. They went to Ocean Park by bus. The teachers were very happy because the students cleaned the bus after the trip.
Japanese visitors: Thirteen visitors from Japan arrived at our school on Monday, June 4th. They visited our school and enjoyed the weekend party with teachers and students.
Basketball world: The school basketball match will be held tomorrow. Both Team Five and Team One hope to be the champion . Who do you think will win?
Talent show : There will be a talent show in our school on June 15th. Lots of students will show their talents by singing, dancing and playing the instruments  at the central hall.",middle7991.txt
