,answers,options,questions,article,id
2,A,"['students', 'policemen', 'old people', 'children']",There are lower prices for   _   in most countries according to the passage.,"Some advice on travel
Here is some advice on travel. I think it will be helpful to you.
1. Forget fashion! Always wear your most comfortable clothes and shoes when you go on long trips.
2. If you're going somewhere cold, remember to take your warm clothes with you.
3. If you are going somewhere sunny, remember to take some sun block  and sunglasses.
4. Traveling on trains and buses can be boring, so you'd better take an MP4 player.
5. Always take a camera with you to _ those special moments.
6. Be careful with your things whenever you go to crowded places, like a train station.
7. Always leave room in your bag for souvenirs .
8. Tour buses often stop at expensive shops along the way. Save your money by buying souvenirs at local shops.
9. Most countries have lower prices for students, so if you are, take your student card with you.
10. If you travel abroad, remember to take your passport.",middle508.txt
