,answers,options,questions,article,id
0,A,"['Do some exercise', 'Clean the shoes', 'Have a rest', 'Eat enough fruit']",_   before leaving.,"Many people like traveling (going to other places). Modern traffic is fast, so going to different places becomes very easy. If you want to travel, you must be healthy. But do you know how to keep healthy when you are traveling? The following information is important for you.
Before leaving:
Wear comfortable shoes, a hat and sunglasses.
Do some exercise for weeks or months before you leave.
While traveling:
Be sure not to eat dirty food or bad fruit.
Drink clean or bottled water.
Find time to take a good rest.",middle5985.txt
