,answers,options,questions,article,id
2,D,"['make the person who hurts us look bad', 'hate the person who hurts us very often', 'accept that you are hurting the other person', 'forgive the person who hurts us and forget it']",The best way to deal with the bitterness is to   _,"Is there some one you hate? Well. Maybe you don't really hate them. But you get really angry every time you think of them.  If you don't let this anger go,  it can turn into bitterness .
Bitterness appears when we can't forgive someone who has hurt us or made us angry. Someone might say or do something that hurts us.  But instead of controlling he anger ,we keep t deep inside .  Before long, a bitter feeling begins to grow. We may think we are hurting that person by criticizing him or her often ,but we are really only hurting ourselves.
Bitterness can not only lead to serious health problems such as heart disease ,but also hurt out relationships with friends and family members .No one enjoy being around an angry person for very long .
If you see bitterness in your life ,here are some ways to deal with it .
Accept it
Instead of trying to _ your anger ,make it clear to yourself and accept it .See your anger for what it is and quickly deal with it .
Stop making excuses for it
You may feel you have a right to be angry .You may think you are right and the other person is wrong . You may even secretly enjoy making the other person look bad .But in the end ,bitterness hurts you much more than the other person . The bitterness will hold you back . and the other person will go on with his or her life .
Forgive and forget it
You probably can not completely put the anger out of your mind .But you can decide to forgive the other person . Forget it and move on .You'll enjoy better health and peace of mind .",middle422.txt
