,answers,options,questions,article,id
0,C,"['in a restaurant', 'in a supermarket', 'in a big hotel', 'in a library']",You would see the notice   _  .,"Welcome to Franklin Hotel. To make your stay enjoyable, we hope you will use our facilities to the full.
Dining Room: You can have three meals in the dining room. (breakfast 8-9 a.m.; lunch 12-2:30 p.m.;
dinner 7:30-9 p.m.)
Room Service: You can dial 0 for Reception  to make a phone call while you are on bed. There are also pay telephones near the reception desk.
Shop: You can buy presents, gifts and goods from 9 a.m. to 5:30 p.m. here.
 _ We have a laundry in the building, and will wash and return your clothes within 24 hours.
You can ask the room staff to collect them.
Bar: The hotel bar is open from 12 to 2 p.m. and 7 p.m. to 11 a.m.
Banking: We can cash cheques  & exchange any foreign money for you.",middle5232.txt
