,answers,options,questions,article,id
3,B,"['The writer plans to head out the Mission Bay next Sunday for a beach picnic.', 'You should finish the homework before leaving for the picnic.', 'You can buy and share food and drinks on the farm', 'The driving time is less than one and a half hour']",Which of the following statement is TRUE?,"Hi, everyone! I am Paul Hawking, the trip leader for this weekend' s activity. It's that time of the year again when the days are long and it is nice to sit outside and enjoy  some oysters .
We plan to head out to the Mission Bay this Sunday for a beach picnic. You can buy fresh oysters at the Mission Bay Oyster Company and you just need to pay $6 to $l0 for each dozen, depending on the size. It' s on Sunday, June 30.
We will meet at the Student Center at 9:00 a.m. and all go together. The driving time is one and a half to two hours, and the time of return is still uncertain. Come and join us in what must now be the 4th or 5th such trip for the Outing Club.
The oyster farm has a small picnic area with chairs and barbecue grills  . Bring some briquettes   if you would like to grill. Except for oysters, oysters and oysters, little is available there, so please bring your own food and drinks. And of course, if you have any special oyster recipes  , bring them make them and share them!
The weather forecast says it's going to be sunny and around 26degC this weekend. My telephone number is 408-896-3228. Please feel free to call me if you have any questions. Remember to finish your homework before we leave for the picnic.",middle5704.txt
