,answers,options,questions,article,id
0,C,"['often forget to buy what you need', 'have to stand to pay for the things', 'can buy everything you need easily', ""can't go back to buy what you forget""]","With Webshop,you   _  .","Click and shop
Do you always go shopping at the supermarket or often forget to buy something? If you do forget something,we believe you never want to go back for it.But with Webshop,our new Internet shopping service,you won't have to.Also avoid  standing so long to pay for what you get.Start shopping online now!
Eat what you like
Do you usually want to avoid eating any spicy  food? Do you always regret drinking t oo much fizzy  drinks? Well,now it's time for you to hold a chance to change the things.You'd better try taking our Gasgo and begin to feel the difference!
24 hours to success
Do you regret not working harder at school? Do you want to improve your languages? With Polyglot's system ,you can learn to speak any language in 24 hours! Try following our system and see how different it is from the rest.Why not make an early start in a class today?
You're never too old to surf 
Do you want to surf the Internet but think you're too old to start learning new skills? If so,why not take a course at Compu Wiz? We promise to make you master a computer whatever your age.Don't forget to call us before July 1st at 2819 0818,and receive a 50% lower price on lessons.",middle2145.txt
