,answers,options,questions,article,id
2,D,"['teachers from Wildwood', 'workers in Wildwood School Library', 'visitors to Wildwood School', 'parents of the Wildwood School students']",This library guide is for  _  .,"Wildwood School Library Guide
This will offer you some information about our school library. You can use this guide to help your kids use our library.
Service hours: 3:00 p.m.--5:30 p.m.on school days; 8:30 a.m.--11:00 a.M.on weekends On school days, your kids may borrow or return books during opening hours only when his classroom teacher allows him to.At the weekend, our library is open to both you and your kids.
Borrowing:
Each student can borrow one or two books at a time. More books can be borrowed only for class reading activities and school research.
Returning:
Books borrowed from the library can be kept for 15 school days. The books must be returned before the due   date or the kid can not borrow other books.
Damaged   or Lost Books:
When a book is returned in a damaged condition, the kid will have to pay three dollars for the damage. Full price must be paid if a book is lost. We encourage students to carry their library books in plastic bags to protect them from rainy weather.
Please call us at 33621323 for more information.",middle7588.txt
