,answers,options,questions,article,id
0,B,"['Three.', 'Four.', 'Five.', 'Six.']",How many personality types are mentioned in the passage?,"In our life,we may meet people with different personalities .What is your personality type ?Read about the following and find out!
A Dreamer thinks there is a""right""way to do things.This person wants to live in the""perfect world"".Many are good listeners and like to help others.Many Dreamers work as teachers,and often lead others.Famous Dreamers:Mohandas Gandhi,Angelina Jolie.
A Partner wants to be in a group.For this person,rules are important.They consider tradition to be of great value.Partners are often serious,careful people.Many do well as teachers,managers and police officers.Famous Partners:Queen Elizabeth II,Mother Teresa.
For Thinkers,understanding things is very important.They like to deal with problems and make new things.Thinkers can also be active.They like to win.They have very strong opinions.Many Thinkers work as scientists,inventors and engineers.Famous Thinkers:Bill Gates,Stephen Hawking.
Artists want to be free.They don't want to follow the rules all the time.They also like trying new things.Like Thinkers,many Artists have strong opinions.They are creative and do well as musicians and actors.Famous Artists:Cristiano Ronaldo,Madonna.",middle5340.txt
