,answers,options,questions,article,id
2,D,"['The birthday party will be held in a park.', ""Sue's mother will make the party invitations."", ""Both Rory and Fifi are Hello Kitty's cousins."", 'Sue will book a Hello Kitty--shaped birthday cake.']",Which of the following is true?,"My name is Sue. I want to have a special party to celebrate my 12th birthday. After discussing it with my family, I decided to have a Hello Kitty theme birthday party.
Hello Kitty Birthday Invitations
An invitation in the shape of a skirt is a fun way to invite my friends to the party. My sister, Lisa, will help me make the invitations. My mom tells me to send out the invitations 3~5 weeks before the date of the party. My birthday party is on December 21, so I will send out the invitations before November 24.
Hello Kitty Theme Decorations
The party will be held in our garden. I plan to put some white and pink balloons around the garden. There will be a vase which is full of pink flowers on each table and a small Hello Kitty on each chair.
Hello Kitty Birthday Party Menu
My parents will cook some delicious food. All of them will be named after Hello Kitty's friends, such as Rory and Fifi. I will _ a birthday cake in the shape of a Hello Kitty at Mrs Green'S Cake Store at the beginning of December.
I hope my friends will enjoy themselves at the special party.",middle4026.txt
