,answers,options,questions,article,id
1,D,"['A computer.', 'A tennis ball.', 'Two tennis rackets.', 'A TV.']",What does Jim have?,"Jim: Good afternoon, Peter!
Peter: Good afternoon, Jim!
Jim: Do you like computer games?
Peter: Yes, I do.
Jim: Let's play computer games.
Peter: That sounds good, but I don't have a computer. Do you have one?
Jim: No, I don't. But I have a TV. What about watching TV?
Peter: No, it's boring. Let's play tennis. I have two tennis rackets   and a ball.
Jim: OK. Where are they?
Peter: On the sofa.
Jim: Get the ball and rackets. Let's go and play.
Peter: OK. Let's go.",middle2242.txt
