,answers,options,questions,article,id
3,A,"['his experience of working in an electronic lab', 'the variety of part-time jobs he has done.', 'his ability of applying for different jobs.', 'the degree he has got.']",The salary for the part-time lab assistant depends on  _  .,"Share Flat   Happy Village big flat, 1 room ready for use immediately, with all necessary furniture and appliances. 3 minutes' walk to underground station, 2 blocks from shopping center, park view, $2100 including bills, female nonsmoker, no pet.
Sara 25720836 or 10077809Moving Sale   2 armchairs, red/brown at $400 each; coffee table, black, wood, $800; oil painting, big, $900; Tianjin carpet, green, 3*7, $600; double bed, $500; mirror, big, square, $500; fridge, big double-door, $1000; old pictures, $140 each.
Mr. Brown, Tel Weekend, 25216011, Weekday, 25245867
Part-time   Lab Assistant Wanted   Required by busy electronics company to help with development of computer, should have an electronic degree and some experience of working in an electronic lab. Hours 9:00am--1:00pm, Monday - Friday
Salary 6,598 - 10,230   dependent on experience
Letter of application to  Mrs. G Chan NOVA ELECTRONICS, 45 Shanxi RD, Shanghai",middle5401.txt
