,answers,options,questions,article,id
3,A,"['We should dress children in dark colours.', ""Fresh roses can cheer us up when we're feeling blue."", 'Dark colours can tell lies.', 'Dressing yourself for the day is quite important.']",Which of the following sentences is NOT right?,"When someone walks into a room wearing bright colours, everyone seems to take notice. Beautiful bright colours can easily draw our attention. Fresh roses can cheer us up when we're feeling blue. Dressing up in colourful clothing can bring us into a more positive mood.
What shall I wear today? What colour should I choose?
Dressing yourself for the day is quite important whether you know it or not. Our moods often show what our bodies end up wearing. When you look in the mirror after you dress, train yourself to notice how you feel when you see yourself. Notice your mood. If you are not feeling yourself, could the colour of what you are wearing irritate   your nervous system? Did you never notice that before? We all know that dark colours can tell lies. They can make you look and feel older than you really are. That is why baby clothes never come in dark colours. To the mind, dark colours seem easier to hold power, but to the heart and feeling level, they don't help your heart to open. Bring happy colours and happiness to go hand in hand. Bright happy colours open your heart, calming your nervous system.
Some advice:
If you work around people who wear black, try to find a happy colour to look at to replace   the picture of dark colours in your mind.
At night, wear soft clothes in light colours to help your nervous system calm down and smooth it out, preparing yourself for sleep.
Don't dress children in dark colours because their nervous systems are just beginning to feel.",middle6537.txt
