,answers,options,questions,article,id
4,D,"['Football', 'Golf', 'Swimming', 'A and B']",What's his favorite sport except basketball?,"Michael Jordan was born on February 17,1963 in Brooklym ,N.Y. And he graduated from North Carolina College. There are four people in his family, his wife Juanita, his sons Jeffrey and Marcus. His favorite food is seafood. His position is board and his favorite sports are golf and football except basketball.
His awards won:
Won a 1982 NCAA Named the Century's Greatest Athlete.
Men's Basketball Title.
Won an Olympic Gold Medal in Men's Basketball.
Won a NBA Title 6 times.(91, 92, 93 ,96, 97, 98)
Broke a NBA play-offs scoring record by scoring 63 in 1986 versus the Boston Celtics.
Named NBA Most Valuable Player 5 times.( 88, 91, 92, 96, 98)",middle7714.txt
