,answers,options,questions,article,id
3,D,"['Because they want to have chickenpox.', ""Because they don't need to go to school."", 'Because she likes staying at home.', 'Because the chickenpox party makes her very happy.']","Why does Anna say ""Can we all have chickenpox again next week?""","One of Anna's friends has chickenpox . Two days later, Katie has chickenpox. Anna's mother says: "" Your best friend has chickenpox . We have to keep an eye on you.""
The next evening, Anna finds some red spots  on her face. The next morning, she stays home from school. She can't go to her grandpa's birthday party. She can't go to her soccer practice. She can't go to the supermarket with her mother.Anna cries : "" I don't like chickenpox. I miss school. I miss my friends.""
Then Anna's mother has an idea.
After lunch, Katie, Mike and Danny come to Anna's home--- all with spots like her. Anna's mother says : "" Let's have a chickenpox party!""
All the afternoon, the kids play games. When Anna's friends have to go home,
""See you at school."" Katie says.
""Having chickenpox is not so bad."" says Danny.
""I know,"" Anna says with a laugh , "" Can we all have chickenpox again next week?""",middle1565.txt
