,answers,options,questions,article,id
1,A,"['Because he wanted to spend Christmas with his children', ""Because he couldn't stand his marriage any longer."", 'Because he and his wife were sick of each other', 'Because he was sick of talking about his marriage.']",Why did the old man call his son on the day before Christmas?,"A man called his son in New York the day before Christmas and said,  ""I have to tell you your Mom and I are going to divorce  ! Thirty years is quite a long time.""
""Dad, what are you talking about?"" the son cried.
The father said:""We are sick of each other. I don't want to talk about it anymore. You call your sister in Chicago and tell her about the news.""
When the daughter got the news, she is very surprised at it.
""What? They are getting divorced."" She shouted, ""I'll stop them."" She called her father immediately, and cried to her father,"" Don't do anything until I get home. I'm calling my brother back, and we'll both be there tomorrow. Wait for us, please.""
The old man hung up his phone and turned to his wife. ""OK"" he said, ""they're coming for Christmas and paying their own way.""",middle48.txt
