,answers,options,questions,article,id
1,B,"['Yes', 'No', 'Not sure', 'Not mentioned  in the article']",Is the food in South China the same as the food in North China for the whole year ?,"On New Year's Day, many people eat special food for good luck.
In Spain  and some Latin American countries ,people eat twelve grapes  at midnight  on New Year's Eve--One grape for good luck in each month of the new year.
Chinese people eat dumplings. Some are made with a coin inside. Everyone tries to find the coin for good luck and money in the new year. Of course  they don't eat the coin . In the south of China, people make rice cakes for New Year. The Chinese pronunciation  for rice cake is ""Nian Gao"", which means ""get better year after year"".
Japanese people eat noodles on New Year's Eve and on their birthdays. They think it may bring them good luck and long life.
The food may be different in each country, but the meaning is the same---people hope the food will bring them luck and happiness(,) in the coming year.",middle5349.txt
