,answers,options,questions,article,id
1,B,"['talk to the bartender', 'trust anybody in the city', 'answer the telephone', 'want to see Pablo']",Emilio didn't  _  .,"Emilio lost his wallet  at a bar .He looked for it everywhere.But he couldn't find it.The bartender  didn't have it,either.Emilio went home.He was very angry.
""Somebody stole my wallet.""he told his wife.""Are you sure?""She asked,""Maybe you just lost it.""""I don't think so.You can't trust anybody in this city.""
Then,Emilio's phone rang.
""Hello?""he said in an angry voice.""Good evening.Is that Emilio Santos?""""Yes,it is.Who is that?""""My name is Pablo.I found your wallet at a bar.""
The next day,Emilio met Pablo at a coffee shop.Pablo returned the wallet.Everything was still inside.Emilio thanked Pablo for being so honest .",middle937.txt
