,answers,options,questions,article,id
2,B,"[""they didn't like eating turkey"", 'the live turkey ran away before they killed it', 'chicken was delicious', 'they like eating chicken']",Eleanor and her family ate chicken because  _  .,"The first Thanksgiving was in 1621. Each year, we celebrate Thanksgiving on the fourth Thursday of November. What do American children think of Thanksgiving? This is what some of them wrote.
Thanksgiving is a holiday to say ""Thank you"". It means eating turkey and having a special party with your family.
Thanksgiving is giving thanks to people that help you. I think it is a special holiday. You give thanks to your family and your friends.
Annie
Lots of people have done things for me that I like. Lots of people like to make me happy, like my mum.
Many people have done things for me and make sure I am all right. I am pleased that people care about me.
Most people I know give me money or presents at Thanksgiving. Sometimes people take me to visit places or ask me to their houses.
I like to do nice things for other people. Also I hope people help me when I get old.
Jeremy
Once we were at my grandparents' house during Thanksgiving and we went to the store to buy a turkey, but they didn't have any, so we had to buy a live one. When we went out to kill it, it had gone! There was nothing left except feathers . That year we had to eat chicken instead of  turkey.
Eleanor
I'm thankful for having a really good mum who looks after me so well and having good teachers and especially Ms. McMillan because she helps to try new things. I love all my family.
I enjoy Thanksgiving because I eat turkey with all my family and I love it.
Ryan",middle4117.txt
