,answers,options,questions,article,id
0,B,"['A table', 'A fridge', 'A window', 'A billboard']",Which of the following can you choose to cover yourself during an earthquake?,"March 28 is China's National School Safety Day. Earthquakes happen all the time all around the world. It is necessary to know safety tips for earthquakes. Here is the Drop, Cover and Hold ways for personal safety during an earthquake.
DROP: Drop down to the floor.
COVER: Take cover under or beside a piece of furniture . Protect your head and neck with your arms. Stay away from windows, mirrors and tall furniture.
HOLD: If you take cover under or beside a piece of furniture, hold on to it until the ground stops shaking.
School tips
Stand beside a wall. This will protect you from falling things. Don't stand near windows or under lights.
Public area tips
When you are in a bookstore or shopping mall, get down beside the counters  or in the corner. Protect your head with your arms or bag.
Stay away from big billboards .
Home tips
If you're in the kitchen, move away from the fridge and lights. When you leave, don't use the lift; take the stairs.",middle5906.txt
