,answers,options,questions,article,id
0,A,"['have a rest', 'learn languages', 'look for interesting jobs', 'visit museums']",Mr Smith goes out to   _   when it's summer or winter holidays.,"Mr Smith teaches English in a university . He is often very busy with work. When it's summer or winter holidays, he goes out to take vacations to relax. Usually he goes to France because he thinks it's an interesting country. And he can speak French very well.
But last month he said to his wife , ""I'm not visiting France this time. I want to go to a different country. I _ Japan. But I can hardly speak Japanese, so I'm going to study it for a month before I go.""
He studied pretty hard for a month, and then his vacation started.
Ten days later, he came back. His wife asked him, ""How about your short vacation in Japan? Did you have any trouble  with your Japanese there?""
""No, I didn't,"" answered Mr Smith. ""But the Japanese did!""",middle1345.txt
