,answers,options,questions,article,id
1,A,"[""Bill's mother"", 'Bill', 'his friend', 'other people']",Mr Green wants to buy a new blouse for   _  .,"One Sunday morning Mr Green and his child , Bill ,are in a big shop . Mr Green wants to
buy a new blouse for Mrs Green . Bill likes oranges , so his father buys two kilos of
oranges for him , too . Bill wants to buy some picture--books and colour pencils , too . There
are many people in the shop . They are men and women , old and young . They all want to buy
something there .",middle2329.txt
