,answers,options,questions,article,id
2,B,"['within 3 weeks', 'all summer', 'all the year round', 'during the whole term']","According to the passage, you can send your articles   _","Articles wanted
School life
Articles should be typewritten  and double spaced, using only side of the page.
Your name, year of birth, school name (and English teacher), home address and e-mail address must be included.
For photos, place the information on the back of each envelope: PLEASE DON'T FOLD.
Please keep copies of your text, pictures or photos.
The sentence MUST BE WRITTEN with your name on each work, ""I promise the above work is completely original .""
If your article is chosen, you will receive a copy of School Life and a special gift.
SEND IT ALL SUMMER!
For more information, please contact us!
Tel: (02) 92136116(02) 92674363
E-mail: schoollife@acpmagazines.com,au
Mail: School Life. Box 5252, Sydney, NSW 200",middle7881.txt
