,answers,options,questions,article,id
0,D,"['policeman', 'teacher', 'doctor', 'detective']",Conan is a   _  .,"She's a lovely girl. She has long and black hair. She is quite tall and slim. Her eyes are bright and black. She is 13 years old.
She is good at singing. She likes listening to music. She is S.H.E.'s fan . Do you know Conan? He is a little detective .The lovely girl also likes him.
Oh, sorry. I forget to tell you who the girl is. It's me. I'm a lovely girl. You can call me Kacely or Kacelin.
Now I study at Sunshine Middle School. I'm in Class 1, Grade 7. Every day, I get up at 6:00 a.m. The classes begin at 7 o'clock. I like lunchtime because I can chat with my friends at that time. After school, I usually play badminton with my friends. I like playing badminton and I am good at it.
I want to be a superstar  when I grow up.",middle1225.txt
