,answers,options,questions,article,id
2,D,"['they are easy', 'he has more time to read them', 'he likes them better', 'the books he bought have no due date']",The writer reads books borrowed from the library faster than the books he bought because  _  .,"For a student, reading ability is very important in our study. How to read faster and understand better? Here is some advice for you.
1. Find Your Purpose for Reading
Before you start reading, ask yourself why you are reading this book. Most people read for two main reasons---pleasure or knowledge. Being clear about your reading purpose not only helps you to stay away from books that you don't need to read. It also reminds you why reading the. book is important to you when you are reading it. You can easily keep reading and finish the book faster.
2. Read Only What You Are Interested in
Whether you're reading fiction or nonfiction, it's important to enjoy what you read. Your friends may share books they love, but those books might not be the ones you enjoy.
3. Give up Books That You Don't Enjoy
You may have chosen books that agree with your purpose. You may have chosen books that you are interested in. But when you are reading them, there may still be some books that you won't enjoy reading, Whenever you realize that you aren't enjoying the book you are reading, give it up. Remember reading shouldn't be a chore. 4. Give Yourself a Deadline to Finish Each Book
Before you read each book, ask yourself when you need to finish this book by. What I find interesting is that I read books that I borrow from libraries faster than the books I bought. The reason is the books I bought don't have a due date! I don't need to return those books, When you don't set a _ to finish your book. There isn't a sense of urgency . And when something isn't urgent, you will like to put it off.",middle4780.txt
