,answers,options,questions,article,id
0,C,"['happy', 'sad', 'excited', 'bored']","When she began to play tennis, Li Na was   _  .","""My dream has come true. I have always wanted to be a Grand Slam   champion."" These are the words of Chinese tennis player Li Na after she became the first Asian woman to win a Grand Slam final in the French Open on June 4, 2011.
""People were saying I'm getting old. So this is a great success for such an old woman,"" the 29-year-old girl joked.
Miss Li has a tattoo  . She has _ her hair many different colors. And, at the 2008 Beijing Olympics, she told her fans to ""shut up"" when they got too noisy in their support.
Li Na was born in Wuhan, she started to play tennis at the age of 6. She once recalled: ""As a child, I felt sad because every day I had to wake up early to practice. After school I had to practice more. I didn't have time to play.""
Luckily, the strong girl didn't give up, thus making history for Chinese tennis time after time.
Now the new champion is already thinking about winning another Grand Slam title. ""When you have one title, surely you will think about another,"" she says, not hiding her ambition  .
""Chinese people are so lacking   in confidence on the tennis court. If there is a person like me who can prove we Chinese can do it, the other young players in China will feel the same,"" she said.
,.",middle2737.txt
