,answers,options,questions,article,id
1,C,"['41861736', '41853051', '41615789', '41586327']",What's the telephone number of Shanghai Sweater Shop?,"In our big city there are a lot of shops near the Department Store. They make a big shopping center and sell all kinds of things. You can always buy everything you want here. Here is a list (;) of big shops.
NameTelephoneAddress
Department Store41853051No.189 Yonghua Road
Mobile Phone Store41653789No.67 Xiangyang Road
Old Wang Shoemaker41861736No.180.Yonghua Road
Shanghai Sweater Shop41615789No.75 Xiangyang Road
Yiwu Shopping Market41836547No.190 Heping Road
Zhiyuan Computer Company41653786No.68 Xiangyang Road
Xiwang Toy Shop41586327No.195 Heping Road
Yang Liuqing Painting Store41861861No.192.Yonghua Road",middle6404.txt
