,answers,options,questions,article,id
4,D,"['She should buy lots of beautiful clothes and a big house.', 'She should go to see the famous doctors in foreign countries.', 'She should give her company to her family.', 'When a person loses his health,he kows how important it is.']",What did Hannah probably realize at last?,"Hannah was born and raised in a poor  framily. She wore hand -me -downs  from her older sisters.For Christmas she usually got used toys and books .As a chilld ,she wanted to have the beautiful clothes ,cars ,and homes that she often saw on TV and in magazines.
Five years after college,she became a manager.Her dream came true.She had her own company near Central Park.She took skiing vacations in the winter and travelled by ship in the summer .At the age of 30,Hannah was on top of the world.
Then she had her usual health check-up.Her doctor told her that she had a serious illness.Her doctor guessed that she had less than a year to live.
He advised ,""If you have any once -in -a-life time plans,do them now.""
Hannah spent her last months in her company.She was looked after by hospice  workers.Her family and friends often visited her .The moment before she died ,she opened her eyes and said,""If you have your health,you have everything.""",middle2278.txt
