,answers,options,questions,article,id
2,B,"['pens', 'maps', 'pencils', 'books']",Murray doesn't have   _   on sale.,"Come to Murray's big sale on clothes and things  for school. They are at a very good price .
Do you like jackets? We have jackets in all colors at 25 dollars  each. Do you need bags for shopping or school? We have great bags for only 9 dollars.
For young boys and girls, we have T-shirts in red, yellow, white and black for only 20 dollars. And socks  in all colors for 2 dollars, skirts and pants for 5 dollars!
See our nice schoolbags, pencils,pens and old books--everything   for school! Come and see for yourself at Murray's shop!
,.",middle7815.txt
