,answers,options,questions,article,id
0,C,"['give them a hug, a card or a joke', 'try your best to do something', 'fight with your brothers or sisters', 'clean up your room without being asked']",Your parents will be unhappy if you  _  .,"Mom and Dad are two of the most important people in your life. You probably see at least one of them every day. If your dad worships the Pittsburgh Steelers, you may grow up being a big fan of that football team. And if your mom loves to read,you just may grow up carrying a book everywhere you go, just like she does.
Here are some ways for you to get along well, and build a strong relationship  with your parents.
Spend time together. Don't sit there playing computer games or watching TV. Ask your mom and dad to play with you. Go outside together, or do some reading.
Be kind. Little things might mean a lot to your mom or dad. You can (make a parent happy) with a hug,a card,or a joke. It's also lovely when a kid cleans up his or her room without being asked. And if you try not to fight with your brothers or sisters, your parents will be so happy!
Do your best at whatever you do. You don't have to be perfect ,but when you do your best,you make your parents proud. It makes them happy to see how you're turning into a great kid. Why? Because it lets them know _",middle7493.txt
