,answers,options,questions,article,id
1,B,"['hotels to live in', 'information about jobs', 'cheap food', 'places to travel']",Craigslist is a website to find   _  .,"If you want to live in Hawaii,you need to think about how to save money,because it is one of the most expensive states in the USA.
Hawaii buys most of its goods from other countries.This makes the prices very high.Eating out can be expensive.Breakfast is at$5 or$8 and lunch ia around$12,while dinner goes from $15 to$30.
What makes living in Hawaii more difficult is that there are few high-paying jobs. For example, it is harder to find engineering jobs than waitressing jobs.
Here is some advice on how to get around and enjoy living in Hawaii.
*Check out online travel websites, magazines and books for information about the islands, from their beaches to their restaurants.
*Find hotels by reading newspapers. You can also find someone to share your room to save money.
*Try to find a job. Craigslist is a good website to start your search. Also, check the newspapers.
*Buy your food and other things at cheap chain stores like Costco and Wal-Mart.
Hawaii is an expensive place to live, but there are ways to save your money if you shop properly.",middle2294.txt
