,answers,options,questions,article,id
1,C,"['tell you about another game', 'teach some word stories', 'show how to play the game', 'teach some small words']",The second part is to   _  .,"Game: Describe and guess
In Describe and guess, players take turns choosing a Word Brick and then describing  one of the words on the brick without saying the actual word. The goal is to get the other players to guess the word.
Instructions
Have students(the players)sit in groups of 3-5 and give each group some Word Bricks.
In their groups,players take turns choosing one Word Brick.Each player shoud not let anyone else see his or her brick.
Each player examines both sides of his or her Word Brick and chooese one of the words.
In turns,each player describes his or her word without saying that word.The other players guess until one guesses the word.
After all of the players'words have been guessed,do steps 2-4 again with new Word Bricks.
End the game after the specified amount of time.
""Player Talk"" in Describe and guess
The player picks a brick with the word one on one side and the on the other side.He or She chooses to describe the.
Describer:Okay,this is a small word. It's very common in English.
Guesser 1:Is it and?
Describer: No.We often use it before the word sun,ocean and weather.
Guesser 2: The.
Describer: Right",middle3279.txt
