,answers,options,questions,article,id
2,B,"['Harry was a rich, energetic and clever man', ""Harry's success comes from his dream amd working hard"", ""Harry's father and wife were both interested in making money"", ""If you help others, you'll get what you have paid""]","From this passage, we can learn that   _  .","Harry had a very small farm. He only had one cow but dreamed about having a large farm. He once asked his father Bill, ""I'd like to have that land over there. How can I get it?"" His father encouraged him to go and talk to the landowner  to see how they could get the land. Harry said. ""But we don't have enough money."" His father said, ""Don't worry. Go and talk to him.""
Several years passed. Harry had not only the land, but also several hundred cows. He had a happy life with his wife.
Later, Harry's wife, Sarah, had a dream. ""I want to build the biggest farm in the world."" She said. They called their friend Manuel about this task. Three days later Manuel had a plan for the whole project. Then they asked, ""How much will it cost?"" Manuel said they needed a lot of money.
""Nobody will lend us so much money to build a farm,"" they thought. But the manager of the bank _ them and their dream.
A few months later, La manuel, the biggest farm in the world, was opened.",middle1055.txt
