,answers,options,questions,article,id
1,B,"['A taxi.', 'A map.', 'A watch', 'A dictionary.']",What should you take with you when you go to a strange city?,"It's easy to get lost   in a _ city. Here are some tips   to help you find the way and get to your destination  .
Take a map with you when you go to a new place. If you lose your way, look at the map, you'll find the place where you want to go.
If you still can't find the place on the map, ask the police for help.They will tell you the right way to go.
Remember the name of your hotel and the street where it is. If you can't find the way back, take a taix.
I hope these tips can help you.",middle7039.txt
