,answers,options,questions,article,id
2,A,"[""Mrs. Green's."", ""Mr. Green's"", ""Their daughter's"", ""Their dog's""]",Whose left leg was hurt?,"Accident Report Form
Accident    A car hit a tree. Four people were in the car.
Weather condition   There was a heavy rain.
Cause   The driver named Li Jun drank too much.
Date of call    March 20th, 2009
Time of call    8:30 p.m.
Name of caller  A man called Zhang Wei. (He was taking a walk there at that time.)
Place   Zhongshan Road, Nanjing
Conditions of victims    Mr. Green hurt his head. Mrs. Green hurt her left leg.
Their daughter felt frightened. Their dog died.
Action  Policemen arrived at 8: 40 p.m. and sent the victims to Gulou
Hospital at 8:45 p.m.",middle3123.txt
