,answers,options,questions,article,id
1,C,"['was built in 1965', 'has 12,750 cars in it', 'has 350 shops in it', 'can hold 750,000 people']",The largest mall in the United States  _  .,"Malls are popular places for Americans to go. Some people spend so much time at malls that they are called ""mall rats "". Mall rats shop until they drop in the hundreds of stores.
People like malls for many reasons. They feel safe because malls have police stations. Parking is usually free, and the weather inside is always fine. The newest malls have beautiful rest places with waterfalls and large green trees.
The largest mall in the United States is the Mall of America in Minnesota. It covers 4. 2 million square feet . It has 350 stores, eight nightclubs, and a large park! There are parking spaces for 12,750 cars. About 750,000 people shop there every week.
The first indoor mall in the United States was built in 1965 in Edina Minnesota. People love doing all their shopping in one place. More malls are built around the country. Now malls are like town centers where people come to do many things. They shop, of course, they also eat in food courts that have food from all over the world. They see films at theaters. Some people even get their exercise by doing the new sport of ""mall walking"". Others go to malls to meet friends.
In some malls, people can see a doctor and even go to the church. In other words, people can do just about everything in malls. Now people can live in their favorite shopping center in fact.",middle1083.txt
