,answers,options,questions,article,id
3,A,"['food', 'animals', 'vegetables', 'fruit']",The passage mainly talks about   _  .,"People in different places eat different things.
In South China people like to eat rice. Sometimes they eat it twice or three times a day. They usually eat it with fish, meat and vegetables. It tastes very delicious.
Japanese like to eat rice, too. They also eat a lot of fish. Sometimes they eat raw   fish.It sounds strange but smells very fresh.
In western countries like Britain, Australia and the USA, the most important food is bread or potatoes. People usually make their bread at home. And they cook potatoes in different ways. In England the most popular food is fish and chips. Sometimes people eat this food at home, in their workplace, in the park or even on the street. People call it ""takeaway"" food.
In China today,there are also much""takeaway""food,and most children like to eat them.",middle6269.txt
