,answers,options,questions,article,id
0,C,"['1928', '1934', '1935', '1948.']",Temple won the first Juvenile Oscar in  _  .,"(1)Shirley Temple, the once-famous child movie star, died at the age of 85 on February 10, 2014. She was born on April 23, 1928. She was good at acting and dancing. In 1934, she starred  in the movie Bright Eyes. From then on she became famous around the world. Later she starred in other movies and won a Juvenile Oscar in February, 1935.
For many Americans born in the 1930s and 1940s, Temple was not just an on-screen star but also a close friend in their childhood. She was remembered by the world as the forever ""little angle"". An American movie star said, ""Little Shirley Temple encouraged the whole country during the Great Depression .""
(2)Shi Li and Cui Jiping are husband and wife. They are disabled. They complete the first Chinese encyclopedic dictionary for deaf people and people with hearing problems.
The dictionary includes words on medicine, education, psychology, law, history and culture about deaf people's life. This book provides a learning tool for this special group of people and it helps them know about the world more easily.
They spent six years and over 1,000,000 yuan on the book. They first collected material for the book by themselves, then they invited a lot of experts  across the country to write.
The book is warmly welcomed by the deaf. One of the readers said, ""The book shows that we're not alone. We can have our own way to communicate with the world. """,middle3711.txt
