,answers,options,questions,article,id
3,D,"[""All of the left-behind children aren't good at study."", 'The left-behind children can see their parents often.', 'The left-behind children have much money.', 'The left-behind children problem is a social problem.']",Which of the following sentences isRIGHT?,"With the development of economics  , the problem of left-behind children   has become a serious social problem. More and more people have realized we should do something to help them.
One of the biggest problems is that the children are all hungry for the love from their parents. Many of them can just get a call or a letter from their parents half a year, a year or even several years, which makes _ When they meet their own troubles, they have no one to talk with. Nobody gives them enough care.
Because of being too far away from their parents, the left-behind children's study is the second biggest problem. From a survey   about their study, only two per cent of the children get good results, while ten per cent of them are common and eighty-eight per cent of them are poor. What a pity!
There are also many other problems of the left-behind children, such as having no ability to protect themselves, unhealthy lifestyles, spending too much pocket money and being crazy about Internet and so on.
In a word, to solve all the problems of the left-behind children needs the government, families and schools to try their best together.",middle332.txt
