,answers,options,questions,article,id
0,D,"['sing a song', 'talk with someone', 'watch TV', 'think about one thing']",It is right for us to   _   when we study.,"All students need to have good study habits . When you have good study habits, you learn things quickly. You also remember them easily.
Do you like to study in the living room ? This is not a good place because it is usually too noisy. You need to study in a quiet place, like your bedroom. A quiet place will help you only to think about one thing.
When you study, do not think about other things at the same time, only think about your
homework. If you do so, you will do your homework more quickly, and you will make fewer mistakes.
Good study habits are very important. If you don't have them, try to learn them. If you have them , try to make them better.",middle6013.txt
