,answers,options,questions,article,id
0,D,"['they are always causing problems', ""there's no way to make them happy"", ""they don't want to travel with their parents"", ""their interests and schedules are different from their parents'""]",The main problem of travelling with teenagers is that  _  .,"Anyone who has ever traveled with a teenager knows that the teenager can make the vacation good or bad for the entire family. As a travel agent, Lynda Maxwell said, ""If teenagers are happy, everybody is happy.""
Teenagers are often interested in travelling, but their interests and schedules often aren't the same as their parents'. It means that when the parents start to look for a place of interest in the early morning, their teenagers may be sleeping soundly!
The thing makes travelling with teenagers very difficult, but it isn't impossible. The experts said, ""The keys to success is what parents do before they travel.""
For many families, the hardest part may be finding a vacation time that is right for everyone. Be sure to sit down with everyone else in the family before setting a date.
""After setting a date, ask teenagers where they would choose to go,"" suggested Maxwell. It is possible that they'd like nothing more than to sit on a beach for a week. ""Maybe there's a compromise ,"" said Maxwell.
""Most teenagers like using the Internet now, so parents can ask them to think up the ideas about what to see and do,"" said Brad Anderson. ""I find teenagers are excellent at making great suggestions.""",middle2449.txt
