,answers,options,questions,article,id
0,B,"['Study at home', 'Do part-time jobs', 'Take part in sports groups', 'Do chores']",What would a Chinese middle school student probably NOT do at the weekends according to the passage?,"Audrey is a Chinese-American student. She has found many value differences between Chinese and Americans.
About money
Americans would like to spend more than they have, so many of them are always in debt . Chinese usually spend less than they have, so many of them have money left in the bank.
American kids love to make money by themselves. Chinese kids always ask their parents for money.
American parents think it is not useful to send their children to an expensive university. Chinese parents would do anything to send their children to a good university and that might make them very poor sometimes.
About school
Many American girls take part in sports, dancing and singing groups while Chinese girls take part in _ groups.
Some American students think that ""B"" is a gift while Chinese students think that ""B"" is terrible.
American parents and Chinese parents
American parents allow their daughters or sons to go out to have some part-time jobs in their free time or at the weekends. Chinese parents usually don't allow their children to do so in middle or high schools.",middle1484.txt
