,answers,options,questions,article,id
1,B,"['dinner is always at six', 'rules for dinner are not strict', 'a family offers food only at four', ""you don't have to wash your hands again after dinner""]","In Ghana,   _  .","Dinner customs are different around the world. If you are a guest in Ghana, thisinformation will help you a lot.
In Ghana, dinner is usually from four in the afternoon to six in the evening. But there are nostrict rules about time. Whenever a guest arrives, a family offers food.
When you go to ahome, the host takes you to the living room first. At this time everyonewelcomes you. Then you go to the dining room. There you wash your hands in a bowl of water.All the food is on the table.
In Ghana you usually eat with your fingers. You eat from the same dish as everyone else.But you eat from one side of the dish only. It is not polite to get food from the other side of thedish. After dinner, you wash your hands again in a bowl of water.
Most meals in Ghana have a dish called fufu. People in Ghana make fufu from the powder of some plants. Sometimes they cut the fufu with a saw because it is very hard.You must chew fufu well, or you may get sick. You eat fufu with the fingers of your righthand only.",middle4476.txt
