,answers,options,questions,article,id
2,C,"['only enjoy western food', 'only enjoy Chinese food', 'enjoy western and Chinese food', 'only enjoy vegetables']",The Smiths can   _   in Hong Kong.,"The Smiths are going to visit Hong Kong next summer. They will fly there. They will spend about two weeks there.
First, they are going to visit all the places of interest  in the city and also do some shopping. They can enjoy shopping until ten o'clock at night.
Second, they are going to eat delicious food there. There are many Chinese and western restaurants there. They can enjoy many kinds of food, for example, fish, meat and vegetables.
Last, they are going to visit Disneyland. There are lots of interesting things to do. They will take lots of photos there.
They are looking forward to their summer holidays.",middle4768.txt
