,answers,options,questions,article,id
4,D,"['A novel', 'A menu', 'A diary', 'An advertisement']",What do you think the passage is?,"Presents For Children's Day
Charles M. Schulz was born in 1922 in Minneapolis, the only child of a housewife and a barber. His interest in comics was encouraged by his father, who loved the funny pages. Charles M. Schulz sold seventeen cartoons to the Saturday Evening Post from 1948 to 1950 and Li'l Folks to the St. Paul Pioneer Press. Peanuts debuted  on October 2, 1950, and ran without interruption for the next fifty years. Charles M. Schulz died in 2000.
*IT'S A DOG'S LIFE  SNOOPY
It's a Dog's Life, Snoopy brings all your familiar friends together for great times and fun.
*IT'S A BIG WORLD  CHARLIE BROWN
Charlie Brown faces some of life's little challenges with the help of Snoopy, Lucy, Peppermint Patty, Linus, and the rest of the gang  in It's a Big World, Charlie Brown.
*PEANUTS 2000
The last one is the special edition Peanuts 2000, which includes all the last year's Peanuts comic strip and Charles M. Schulz's famous farewell strip.
Come and visit our website at www.ballantinebooks.com or come to Ballantine Bookshop, you'll have a big surprise.",middle7153.txt
