,answers,options,questions,article,id
0,D,"['Thirty-one.', 'Thirty-two.', 'Thirty-three.', 'Thirty-four.']",How old is Jay Chou now?,"Do you want to make friends with a special man? Here is some information about him.
He is quiet and shy. He likes to hide his eyes behind his hair. He doesn't smile very often. However, if you talk to him about music, he'll have a lot to say.
This is Jay Chou, the 34-year-old Taiwanese pop king . His fans are so excited because he will have a singing party next month. Many pop stars will come, too.
Chou grew up just with his mother. He did not talk much and did badly in many school subjects.  His mother noticed the boy's special interest in music and sent him to learn piano when he was only three years old. He loved it and kept on practicing.
Chou is not very handsome. He does not speak clearly when he sings or talks. But the singer has a lot of fans. ""He is really good at music. It makes him attractive  to me, "" said Liu Jiajun, a Junior 2 student in No. 101 Middle School in Beijing.  ""He is true to himself. _ , ""said Zhang Yujie, a Junior 1 girl at No.23 Middle School in Nanjing, Jiangsu Province.",middle3575.txt
