,answers,options,questions,article,id
2,B,"['volleyball', 'table tennis', 'yo--yo', 'football']",Paula's favourite sport is   _  .,"Paula   Monday  Tuesday Wednesday   Thursday    Friday
get up  7:10a.m.    7:10a.m.    7:10a.m.    7:10a.m.    7:10a.m.
morning school  school  school  school  school
lunch   pizza   rice    rice    rice    rice
afternoon   Yo--yo  Table tennis    Table tennis    Table tennis    football
evening homework    homework    television  homework    clothes
Go to sleep 10:15p.m.   10:15p.m.   10:15p.m.   10:15p.m.   10:15p.m.",middle2684.txt
