,answers,options,questions,article,id
3,D,"['children are good babysitters.', 'children can deliver newspapers.', 'old people living alone need help.', 'American children work to make pocket money']",The main idea of this passage is that  _  .,"Taking care of small children is one of the ways to make money.It is also called babysitting.Most parents do not have relatives living with them.They need someone to watch the children if they want to go out.A babysitter may play games, draw pictures, or read stories to the children, and then put them to bed at the proper time.
Mowing lawns for the neighbors is another common job.When people do not have time to mow their lawns in the garden, they are glad to pay somebody to do this.
Boys and girls can also help deliver newspapers in the neighborhood.They can walk or ride bicycles to deliver newspapers from house to house.They must do this every day if they want to make money in this way.
Some old people who live by themselves need help.Let them know if you like to help with the clean-up work, or go out to mail letters or buy things for them.They will perhaps pay you something each time or every week.
There are many ways to make money.American children often look around to see what work they can do to earn their pocket money.",middle7167.txt
