,answers,options,questions,article,id
1,B,"['Exciting', 'Boring', 'Interesting', 'Relaxing']",What does the writer think of soap operas?,"There are five people in my family. We all like watching TV, but we like different TV shows .
My grandpa is a great fan  of Beijing Opera . He likes watching it very much. Now he is in a Beijing Opera club . There he talks about Beijing Opera and acts in it with other Beijing Opera fans.
My grandma likes cross talk , and she often watches it on TV. Her favorite cross talker is Guo Degang.
My father is a reporter from a TV station . He watches all kinds of TV shows, but his favorite TV show is news.
My mother is a teacher. Her favorite TV shows are soap operas . She thinks they are very interesting. But I think they are very boring.
I like playing basketball, so my favorite TV shows are sports shows. I like watching basketball games best on TV.
What kind of TV shows do your family like?",middle6414.txt
