,answers,options,questions,article,id
3,C,"['Books about detectives.', 'Famous detectives.', 'A famous writer.', 'Agatha Christie or Agatha Miller.']",What's the best title of the passage?,"One of the most famous writers from England by far is Agatha Christie.
Agatha Christie's real name was Agatha Miller. She was born in England in 1890.She married Archibald Christie when she was 24 years old, and she changed her family name to Christie.
She sold her first mystery book in 1920. This book was the first time that the world met Mrs.Christie's famous detective Hercule Poirot. Ten years after that, Mrs. Christie wrote her book with her second famous detective, Miss Marple.
In 1928, Mrs. Christie's first marriage broke up. She married M.E.L. Mallowan in 1930, but she still wrote her books under the name Agatha Christie.
In her life, Agatha Christie wrote 60 books, 16 plays, and more than 100 short stories. She passed away in 1976 when she was 85 years old. Her books can still be found on sale in bookstores all around the world.",middle1179.txt
